date,time,type,title,url,speaker,end_time,abstract,overview,matched_teams,relevance_scores,team_research_focus,matching_reasons
"Tuesday, Dec 2, 2025",13:30,Tutorial,How to Build Agents to Generate Kernels for Faster LLMs (and Other Models!),https://neurips.cc/virtual/2025/128792,,16:00,"The compute demanded by modern AI has been exploding since 2016; the FLOPs used to train frontier models have grown at a rate of 2.4x per year [0], and the inference side is growing even faster—already an estimated 80% of total AI electricity use [1]. Large language models and other deep networks rely on highly tuned GPU kernels to achieve state-of-the-art performance; these efficient kernels directly translate to cost and energy savings. In this 2.5-hour in-person tutorial, we demonstrate how LLM-powered agents can generate and optimize GPU kernels for CUDA, HIP/ROCm, and Triton. We begin with a unified primer on GPU‐programming fundamentals and common tooling (memory hierarchy, occupancy, profilers), then introduce an agentic loop: prompt engineering, compiler/profiler feedback as tools, iterative kernel refinement, correctness validation, and automated benchmarking. We will provide additional benchmarking examples on HIP and Triton, on top of Stanford’s KernelBench that covers CUDA [2], KernelBot as reliable source of human curated dataset for heterogenous GPU code [3], and show how to turn runtime and profiler metrics into reward signals that drive kernel optimizations. On top of this loop, we build an inference-scaling framework in which the LLM proposes candidate kernels, compiles them, measures latency/throughput/energy, and feeds those signals back as rewards. By combining test-time scaling techniques the agent iteratively discovers increasingly accurate and efficient kernels. Attendees will compare generated code against expert kernels, inspect wins and losses. By the end, participants will walk away with a reproducible pipeline for LLM-driven GPU‐kernel optimization.",,"计算, 海思, 多伦多云","计算:80, 海思:75, 多伦多云:60",计算:GPU kernel优化与计算架构; 海思:LLM推理的kernel加速; 多伦多云:Agent自动代码生成能力,计算:Kernel优化是计算架构的核心，直接影响芯片设计和算力效率; 海思:优化的GPU kernel直接提升LLM推理速度; 多伦多云:展示Agent在专业编程任务中的能力
"Tuesday, Dec 2, 2025",13:30,Tutorial,"Positional Encoding: Past, Present, and Future",https://neurips.cc/virtual/2025/128797,,16:00,"""Positional Encoding is a foundational yet often opaque component of Transformerarchitectures, underpinning how self-attention mechanisms capture sequence orderin language, vision, and multimodal models. Despite its centrality to the successof modern LLMs, and other attention-reliant architectures, the mathematical in-tuition behind positional encoding remains challenging and inaccessible to manyresearchers and practitioners. This workshop aims to demystify positional encodingby bridging formal theory with intuitive understanding and practical experimen-tation. Through a series of guided lectures, visual demonstrations, and hands-oncoding sessions, participants will explore the operational principles behind ef-fective positional representations, the evolution of key methods (from sinusoidaland learned embeddings to rotary and relative encodings), and open challengesthat motivate current research directions. We will also provide open-source codeimplementations, mathematical visualizations, and collaborative ideation sessionsfor fostering new positional encoding concepts. By easing the barrier to entry forthis mathematically intensive, yet crucial topic, the workshop seeks to foster deeperunderstanding, interdisciplinary exchange, and novel contributions to the future ofPositional Encoding, and Transformer design""",,"诺亚, 计算, 海思","诺亚:75, 计算:70, 海思:60",诺亚:长序列位置编码优化; 计算:位置编码对模型架构的影响; 海思:位置编码的计算效率,诺亚:Positional encoding是长序列建模的关键，不同编码方式直接影响长序列性能; 计算:位置编码演进(sinusoidal→RoPE等)是模型架构重要变化; 海思:位置编码计算影响推理效率
"Tuesday, Dec 2, 2025",13:30,Tutorial,Science of Trustworthy Generative Foundation Models,https://neurips.cc/virtual/2025/128795,,16:00,"We are living through a moment that once belonged to science fiction: generative foundation models can write, reason, design, diagnose, and increasingly, decide. They are no longer just predicting the next word — they are shaping knowledge, influencing choices, and becoming collaborators in science, medicine, education, and daily life. But here's the tension: as their capabilities accelerate, our ability to trust them has not kept pace.Trustworthiness can't remain a ""patch after the failure"" or a moral hope layered on top of engineering. It must evolve into a science—a discipline as rigorous as the one that created these models in the first place. In this tutorial, we explore what that science looks like: how we understand model behaviors, measure and stress-test trust, and design systems that earn it. We'll build the foundations together, then step into the frontier—where models begin to exhibit human-like cognitive behaviors that inspire wonder, but also demand responsibility and new forms of alignment.This session is an invitation: to move beyond building models that impress us, toward building models we can trust with what matters.",,多伦多云,多伦多云:60,多伦多云:生成式Agent的可信赖性评估,多伦多云:Tutorial关注generative models的trustworthiness，与Agent行为可靠性和评估准确性相关
"Wednesday, Dec 3, 2025",08:30,Invited Talk,The Oak Architecture: A Vision of SuperIntelligence from Experience,https://neurips.cc/virtual/2025/invited-talk/129132,Rich Sutton,09:30,"As AI has become a huge industry, to an extent it has lost its way. What is needed to get us back on track to true intelligence? We need agents that learn continually. We need world models and planning. We need knowledge that is high-level and learnable. We need to meta-learn how to generalize. The Oak architecture is one answer to all these needs. It is a model-based RL architecture with three special features: 1) all of its components learn continually, 2) each learned weight has a dedicated step-size parameter that is meta-learned using online cross-validation, and 3) abstractions in state and time are continually created in a five-step progression: Feature Construction, posing a SubTask based on the feature, learning an Option to solve the subtask, learning a Model of the option, and Planning using the option’s model (the FC-STOMP progression). The Oak architecture is rather meaty; in this talk we give an outline and point to the many works, prior and contemporaneous, that are contributing to its overall vision of how superintelligence can arise from an agent’s experience.",,"温哥华云, 诺亚, 多伦多云, 计算, 存储","温哥华云:85, 诺亚:75, 多伦多云:70, 计算:65, 存储:50",温哥华云:强化学习架构与RFT; 诺亚:Learning from experience训练框架; 多伦多云:Agent持续学习与自主优化; 计算:RL训推新范式的计算需求; 存储:持续学习的经验数据管理,温哥华云:Rich Sutton的model-based RL架构与RFT研究直接相关; 诺亚:Oak的learning from experience核心理念完全对应其研究方向; 多伦多云:持续学习和planning机制是Agent自主优化的关键; 计算:RL范式对计算系统有独特需求; 存储:持续学习需要高效经验管理
"Wednesday, Dec 3, 2025",14:30,Invited Talk,Are We Having the Wrong Nightmares About AI?,https://neurips.cc/virtual/2025/invited-talk/129136,Zeynep Tufekci,15:30,"Though seemingly opposite, doom and optimism regarding generative AI's spectacular rise both center on AGI or even superintelligence as a pivotal moment. But generative AI operates in a distinct manner from human intelligence, and it’s not a less intelligent human on a chip slowly getting smarter anymore than cars were mere horseless carriages. It must be understood on its own terms. And even if Terminator isn’t coming to kill us or superintelligence isn’t racing to save us, generative AI does bring profound challenges, well-beyond usual worries such as employment effects.  Technology facilitates progress by transforming the difficult into easy, the rare into ubiquitous, the scarce into abundant, the manual into automated, and the artisan into mass-produced. While potentially positive long-term, these inversions are extremely destabilizing during the transition, shattering the correlations and assumptions of our social order that relied on superseded difficulties as mechanisms of proof, filtering, sorting and signaling. For example, while few would dispute the value of the printing press or books, their introduction led to such destructive upheaval that the resulting religious wars caused proportionally more deaths than all other major wars and pandemics since combined. Historically, a new technology's revolutionary impact comes from making what's already possible and desired cheap, easy, fast, and large-scale, not from outdated or ill-fitting benchmarks that technologists tend to focus on. As such, Artificial Good-Enough Intelligence can unleash chaos and destruction long before, or if ever, AGI is reached. Existing AI is good enough to blur or pulverize our existing mechanisms of proof of accuracy, effort, veracity, authenticity, sincerity, and even humanity. The tumult from such a transition will require extensive technological, regulatory, and societal effort to counter. But the first step to getting started is having the right nightmares.",,,,,社会学和人文视角的AI影响讨论，与技术研究团队相关度低
"Thursday, Dec 4, 2025",08:30,Invited Talk,The Art of (Artificial) Reasoning,https://neurips.cc/virtual/2025/invited-talk/129134,Yejin Choi,09:30,"Scaling laws suggest that “more is more” — brute-force scaling of data and compute leads to stronger AI capabilities. However, despite rapid progress on benchmarks, state-of-the-art models still exhibit ""jagged intelligence,"" indicating that current scaling approaches may have limitations in terms of sustainability and robustness. Additionally, while the volume of papers on arXiv continues to grow rapidly, our scientific understanding of artificial intelligence hasn't kept pace with engineering advances, and the current literature presents seemingly contradictory findings that can be difficult to reconcile. In this talk, I will discuss key insights into the strengths and limitations of LLMs, examine when reinforcement learning succeeds or struggles in reasoning tasks, and explore methods for enhancing reasoning capabilities in smaller language models to help them close the gap against their larger counterparts in specific domains.",,"诺亚, 温哥华云, 计算, 海思","诺亚:85, 温哥华云:75, 计算:70, 海思:55",诺亚:后训练Reasoning与RL方法; 温哥华云:RL for LLMs的实践问题; 计算:Reasoning训练范式的计算特征; 海思:推理任务的加速优化,诺亚:Yejin Choi讨论的reasoning+RL完全是其核心研究领域; 温哥华云:Talk分析RL在reasoning中的成功与挑战，对RFT有直接指导; 计算:Reasoning范式影响训练负载特征; 海思:推理任务的加速优化对推理加速有意义
"Thursday, Dec 4, 2025",14:30,Invited Talk,"On the Science of “Alien Intelligences”: Evaluating Cognitive Capabilities in Babies, Animals, and AI",https://neurips.cc/virtual/2025/invited-talk/129137,Melanie Mitchell,15:30,"Today’s generative AI systems—termed by some researchers as “alien intelligences”—have exceeded human performance on many benchmarks meant to test humanlike cognitive capabilities.  However, these systems still struggle in unhumanlike ways on real-world tasks requiring these capabilities.  This disconnect may be due in part to neglect in the AI community of well-founded experimental protocols for evaluating cognition.  In this talk I will summarize several recommendations on experimental methods from developmental and comparative psychology—fields that study the “alien intelligences” of babies and non-human animals—and demonstrate the application of such methods in two case studies of cognitive abilities in LLMs: analogical reasoning and visual abstraction.",,多伦多云,多伦多云:65,多伦多云:Agent认知能力评估方法学,多伦多云:Talk提出的认知评估方法论可应用于Agent评估，对应其'提升Agent评估准确性'的研究需求
"Friday, Dec 5, 2025",08:30,Invited Talk,From Benchmarks to Problems - A Perspective on Problem Finding in AI,https://neurips.cc/virtual/2025/invited-talk/129135,Kyunghyun Cho,09:30,"During the past 15 years or so, I have worked on a series of seemingly distinct but eventually related problems, including machine learning algorithms, generative modeling with neural networks, machine translation, language modeling, medical imaging, a bit of healthcare, protein modeling and a bit of drug discovery. I chose to work on some of these problems intentionally, while it was pure serendipity that I worked on some others. It was only in hindsight that these seemingly different problems turned out to be closely related to each other from both technical, social and personal perspectives. In this talk, I plan to do my own retrospective on my own choices, be them intentional or not, on these problems and share with you my thoughts what our own discipline, which is sometimes called computer science, data science, machine learning or artificial intelligence, is.",,,,,研究方法论和问题选择的元讨论，与具体技术研究方向相关度低
"Friday, Dec 5, 2025",14:30,Invited Talk,Demystifying depth: Principles of learning in deep neural networks,https://neurips.cc/virtual/2025/invited-talk/129133,Andrew Saxe,15:30,"Deep neural networks have revolutionized artificial intelligence, yet their inner workings remain poorly understood. This talk presents mathematical analyses of the nonlinear dynamics of learning in several solvable deep network models, offering theoretical insights into the role of depth. These models reveal how learning algorithms, data structure, initialization schemes, and architectural choices interact to produce hidden representations that afford complex generalization behaviors. A recurring theme across these analyses is a neural race: competing pathways within a deep network vie to explain the data, with an implicit bias toward shared representations. These shared representations in turn shape the network’s capacity for systematic generalization, multitasking, and transfer learning. I will show how such principles manifest across diverse architectures—including feedforward, recurrent, and linear attention networks. Together, these results provide analytic foundations for understanding how environmental statistics, network architecture, and learning dynamics jointly structure the emergence of neural representations and behavior.",,计算,计算:65,计算:深度网络学习动力学与架构演进,计算:深度学习理论有助于理解模型架构演进的根本驱动力，支持计算架构的前瞻性设计
