title,authors,date,time,location,abstract,website
CogInterp: Interpreting Cognition in Deep Learning Models,"Eric Bigelow, Jennifer Hu, Ekdeep S Lubana, Kanishk Gandhi, Laura Ruis, Thomas Fel, Ellie Pavlick, Noah Goodman",Sun 7 Dec,8 a.m. PST — 5 p.m. PST,Upper Level Room 5AB,"Recent innovations in deep learning have produced models with impressive capabilities, achieving or even exceeding human performance in a wide range of domains. A timely and critical challenge in AI is understanding what behaviors these models are actually capable of, and the internal processes which support these behaviors. As interest continues to grow in models’ internal processes, the field of cognitive science is becoming increasingly useful for describing and understanding cognition in deep learning models: cognitive science, which seeks to describe the cognitive processes in human and animal minds, offers a rich body of theories, experiments, and frameworks which may be adopted to understand how deep learning models achieve complex behaviors in domains such as language, vision, and reasoning. The workshop will focus on Cognitive Interpretability (“CogInterp”), which involves the systematic interpretation of high-level cognition in deep learning models. Similar to how cognitive science describes the intermediate representations and algorithms (or cognition) between behavior and neurons in biological systems, the goal of Cognitive Interpretability is to describe the cognitive processes which lie between the levels of behavioral evaluations and mechanistic interpretability in deep learning models. Practically speaking, this means that Cognitive Interpretability does not just ask whether a model can perform task X or has a certain ability Y , but additionally (or instead) how a model performs X or learns and implements Y . These kinds of inferences—from observable behavior to latent “mental” processes—are the bread and butter of cognitive science, but many of the theoretical and empirical tools developed to tackle these problems have not yet been widely adopted in AI research, in part because of the separation between the fields and communities. To address the gap above, our goal is to bring together researchers in cognitive science and AI interpretability to discuss new empirical results and theories about the inner workings of deep learning models. We hope to gather perspectives from various disciplines, including machine learning, psychology, linguistics, vision science, neuroscience, philosophy of mind, and law.",https://coginterp.github.io/neurips2025/
"NeurIPS 2025 Workshop on Space in Vision, Language, and Embodied AI","Ziqiao Ma, Freda Shi, Jiayuan Mao, Jiafei Duan, Manling Li, David Hsu, Parisa Kordjamshidi",Sun 7 Dec,8 a.m. PST — 5 p.m. PST,Upper Level Room 29A-D,,https://space-in-vision-language-embodied-ai.github.io/
Workshop on Mechanistic Interpretability,"Neel Nanda, Martin Wattenberg, Sarah Wiegreffe, Atticus Geiger, Julius Adebayo, Kayo Yin, Fazl Barez, Lawrence Chan",Sun 7 Dec,8 a.m. PST — 5 p.m. PST,Upper Level Room 30A-E,,https://mechinterpworkshop.com
"Evaluating the Evolving LLM Lifecycle: Benchmarks, Emergent Abilities, and Scaling","Berivan Isik, Beyza Ermis, Nithya Attaluri, Rishi Bommasani, Marius Hobbhahn, Yangjun Ruan, Diyi Yang",Sun 7 Dec,8 a.m. PST — 5 p.m. PST,Upper Level Room 2,,https://sites.google.com/corp/view/llm-eval-workshop
Symmetry and Geometry in Neural Representations,"Francisco Acosta, Chase van de Geijn, Simone Azeglio, Christian A Shewmake, Sophia Sanborn, Nina Miolane",Sun 7 Dec,8 a.m. PST — 5 p.m. PST,Upper Level Ballroom 6A,"The fields of biological and artificial intelligence are increasingly converging on a shared principle: the geometry and topology of real-world structure play a central role in building efficient, robust, and interpretable representations. In neuroscience, mounting evidence suggests that neural circuits encode task and environmental structure through low-dimensional manifolds, conserved symmetries, and structured transformations. In deep learning, principles such as sparsity, equivariance, and compositionality are guiding the development of more generalizable and interpretable models, including new approaches to foundation model distillation. The NeurReps workshop brings these threads together, fostering dialogue among machine learning researchers, neuroscientists, and mathematicians to uncover unifying geometric principles of neural representation. Just as geometry and symmetry once unified the models of 20th-century physics, we believe they may now illuminate the computational foundations of intelligence.",https://www.neurreps.org/
"LAW 2025: Bridging Language, Agent, and World Models for Reasoning and Planning","Zhen Wang, Ziqiao Ma, Jessy Lin, Melanie Sclar, Jianwen Xie, Kelsey Allen, Alane Suhr, Jacob Andreas, Tianmin Shu, Zhiting Hu",Sun 7 Dec,8 a.m. PST — 5 p.m. PST,Upper Level Ballroom 20D,,https://sites.google.com/view/law-2025
GPU-Accelerated and Scalable Optimization (ScaleOpt),"Parth Nobel, Fangzhao Zhang, Maximilian Schaller, Alexandre Amice, Tobia Marcucci, Tetiana Parshakova, Stephen Boyd",Sun 7 Dec,8 a.m. PST — 5 p.m. PST,Upper Level Room 9,"Recent advancements in GPU-based large-scale optimization have been remarkable. Recognizing the revolution in optimizing neural network weights via large-scale GPU-accelerated algorithms, the optimization community has been interested in developing general purpose GPU-accelerated optimizers for various families of classic optimization problems, including linear programming, general conic optimization, combinatorial optimization, and more specific problem families such as flow optimization and optimal transport. Beyond deploying GPUs directly at classical problems, current frontier AI tools—including large language models (LLMs)—are being deployed to solve optimization problem. Various works have used neural networks to solve mixed integer problems, linear or quadratic programs, general combinatorial optimization problems, and more specific optimization problems such as LASSO and robust PCA. In this workshop, we aim to provide a platform for interested researchers to engage with each other on recent breakthroughs and current bottlenecks in designing large-scale GPU-based optimizers and synergizing AI systems with solving optimization problems.",https://cvxgrp.org/scaleopt
Data on the Brain and Mind,"Catherine Ji, Vivek Myers, Archer Wang, Benjamin Eysenbach, Jenelle Feather, Erin Grant",Sun 7 Dec,8 a.m. PST — 5 p.m. PST,Upper Level Room 10,,https://data-brain-mind.github.io/
Foundations of Reasoning in Language Models,"Audrey Huang, Adam Block, Sadhika Malladi, Will Merrill, Tatsunori Hashimoto, Dylan J Foster, Akshay Krishnamurthy, Pavel Izmailov",Sun 7 Dec,8 a.m. PST — 5 p.m. PST,Upper Level Room 33ABC,"Our workshop’s goal is to advance foundational understanding, principled innovations, and rigorous scientific evaluations for reasoning in language models. These advancements are built upon theoretical analyses and controlled empirical studies that illuminate how reasoning emerges, where it fails, and how it can be systematically improved. We want to foster dialogue between communities with complementary strengths---those building theoretical models of reasoning phenomena, those designing experiments that reveal its emergence or failure in practice, and those proposing algorithmic developments that advance reasoning---around three primary questions: 1. How are language models able to solve complex tasks, and what do they still struggle with? 2. What fundamental challenges stand in the way of advancing reasoning capabilities? 3. What algorithmic innovations can overcome these obstacles?",https://reasoning-workshop.github.io/
Learning from Time-Series for Health,"Max Xu, Hyewon Jeong, Wanting Mao, Girish Narayanswamy, Sujay Nagaraj, Tom Hartvigsen, Xin Liu, Sana Tonekaboni, James Rehg",Sun 7 Dec,8 a.m. PST — 5 p.m. PST,Upper Level Room 28A-E,"Time-series data underpin modern healthcare, spanning electronic health records, physiological waveforms, wearables, and population trends, yet their unique characteristics—including uncertain ground truth, quasi-periodic physiological motifs, and non-semantic timepoints—demand specialized machine learning approaches. While recent advances in foundation models, multimodal learning, and generative methods show promise, significant challenges remain in causality, interpretability, and deployment. This workshop unites researchers across health time-series domains (from wearables to clinical systems) to address shared challenges through: (1) cross-domain discussion, (2) diverse industry/academic perspectives (featuring Google, Oura, Apple and 5 institutions), and (3) community engagement via posters, talks, and panels. By fostering cross-domain collaboration on physiological-aware methods, we aim to bridge the gap between cutting-edge ML and real-world healthcare impact.",https://timeseries4health.github.io/
Multimodal Algorithmic Reasoning Workshop,"Anoop Cherian, Kuan-Chuan Peng, Suhas Lohit, Honglu Zhou, Kevin Smith, Josh Tenenbaum",Sun 7 Dec,8 a.m. PST — 5 p.m. PST,Upper Level Room 11AB,"Large AI frameworks have been increasing in their data modeling abilities at an ever more vigor in recent times, with compelling applications emerging frequently, many of which may even appear to challenge human intelligence. Yet despite such impressive performance, there remain open questions about whether these models include the foundations of general intelligence, or whether they perform these tasks without human-like understanding. This necessitates development of better tools for assessing these models in tandem with developing the models themselves. This workshop focuses on the topic of multimodal algorithmic reasoning, where an agent needs to assimilate information from multiple modalities towards deriving reasoning algorithms for complex problem solving. In the last year, we have seen rapid advances in AI capabilities that better bridge across modalities, bringing both optimism about superhuman capabilities and skepticism about the limits of current approaches. Through talks from outstanding researchers and faculty, we hope to dive deep into this exciting topic at the intersection of theory, multimodal learning and cognitive science to understand what we have achieved thus far in machine intelligence and what we are lacking in relation to the human way of thinking, towards finding the missing rungs on the ladder to truly intelligent reasoning.",https://marworkshop.github.io/neurips25/
Learning to Sense (L2S),"Shashank Agnihotri, Mishal Fatima, Marius Bock, Kanchana Vaishnavi Gandikota, Jovita Lukasik, Margret Keuper, Michael Moeller",Sun 7 Dec,8 a.m. PST — 5 p.m. PST,Upper Level Room 32AB,"The workshop explores the joint optimization of sensors and machine learning models, pushing beyond traditional paradigms of data acquisition and processing. We aim to rethink the foundations of how machines sense the world by replacing hand-crafted ISPs, leveraging learnable sensor layouts, and adopting task-driven sensing strategies. We welcome original contributions and position papers on the following topics (non-exhaustive): * Sensor optimization for e.g. computer vision (bit-depth, pixel layouts, color filter design) * RAW-to-task or RAW-to-label approaches for visual tasks * Co-design of neural networks and sensor hardware * Low-bit and energy-efficient sensing for embedded or mobile devices * Benchmarks, datasets, and metrics for evaluating sensor-model pipelines * Generalization and robustness of sensor-model systems in real-world conditions * Failure case studies and negative results in joint optimization pipelines Join us to engage with cutting-edge research and cross-disciplinary discussions that are shaping the future of sensor systems for real-world deployment across mobile, embedded, and autonomous platforms.",https://sites.google.com/view/l2s-workshop/home
What Can(\'t) Transformers Do?,"Tobias Schnabel, Kiran Tomlinson, Lena Strobl, Michael Hahn",Sun 7 Dec,8 a.m. PST — 5 p.m. PST,Upper Level Room 4,"With most advances in large foundation models (LFMs) being empirical, our theoretical understanding of what transformers can compute, express, and learn still lags behind. This workshop will convene theorists and empiricists to chart a rigorous agenda for the next generation of LFMs, asking “What _can_ and _can’t_ transformers do?” We welcome both formal analyses and empirically grounded studies that shed light on theoretical questions, aiming to close the gap between proofs and practice while fostering new, interdisciplinary collaborations.",https://transformerstheory.github.io/
Frontiers in Probabilistic Inference: Learning meets Sampling,"Tara Akhound-Sadegh, Michael Albergo, Joey Bose, Marylou Gabrié, Louis Grenioux, Guan-Horng Liu, Kirill Neklyudov, Grant Rotskoff, Eva Smorodina, Alexander Tong",Sun 7 Dec,8 a.m. PST — 5 p.m. PST,Upper Level Room 7,,http://fpiworkshop.org
Tackling Climate Change with Machine Learning,"Hari Prasanna Das, Raluca Georgescu, Joaquin Salas, Salva Rühling Cachay, Nadia Ahmed, Yoshua Bengio",Sun 7 Dec,8 a.m. PST — 5 p.m. PST,Upper Level Room 24ABC,"Many in the ML community wish to take action on climate change, but are unsure how to have the most impact. This workshop will highlight work that demonstrates that, while ML is no silver bullet, it can be an invaluable tool in reducing greenhouse gas emissions and in helping society adapt to the effects of climate change. Climate change is a complex problem for which action takes many forms, from advancing theory to deploying new technology. Many of these actions represent high-impact opportunities for real-world change, and simultaneously pose interesting academic research problems. The theme of this workshop, “Roots to Routes: A Dialogue on Different Machine Learning Methods for Climate Impact,” invites submissions that explore the strengths of diverse machine learning approaches in climate-related contexts. We particularly encourage work that demonstrates the effectiveness of classical ML methods under real-world constraints, such as limited data availability, privacy concerns, or restricted computational resources. At the same time, we welcome contributions that showcase how scaling up data and computing resources combined with modern tools and techniques can unlock new possibilities for tackling global-scale climate prediction challenges. This workshop is part of a series that aims to bring together those applying ML to climate change challenges and facilitate cross-pollination between ML researchers and experts in climate-relevant fields.",https://www.climatechange.ai/events/neurips2025
Regulatable ML: Towards Bridging the Gaps between Machine Learning Research and Regulations,"Chirag Agarwal, Jiaqi Ma, Sarah Tan, Himabindu Lakkaraju, Junwei Deng, Pingbang Hu, Eileanor LaRocco, Karolina Naranjo, Shichang (Ray) Zhang",Sun 7 Dec,8 a.m. PST — 5 p.m. PST,Upper Level Room 1AB,,https://regulatableml.github.io/
AI for Science: The Reach and Limits of AI for Scientific Discovery,"Ada Fang, Marinka Zitnik, Max Welling, Carla Gomes, Yuanqi Du, Sanjeev Raja, Lixue Cheng, Lijing Wang, Michael Albergo",Sun 7 Dec,8 a.m. PST — 5 p.m. PST,Upper Level Ballroom 20A,"Through our proposed AI for Science workshop, we will bring together experimentalists, domain scientists, and ML researchers to discuss the reach and limits of AI for scientific discovery. We will center our discussion on three challenges that are essential to progress across scientific domains: **LLM reasoning across scientific domains** – can present-day LLMs generate rigorously testable hypotheses and reason over experimental results that span scientific domains such as physics, chemistry, and biology? **Fidelity of generative and surrogate simulators** – In biology, we see a shift towards all-atom models with increasingly powerful capabilities, in chemistry machine learning force fields are increasing in accuracy and generalizability, and in climate modeling we can now accurately predict weather 15 days out. How far can we push this limit? What spatial or temporal scales remain intractable? **Experimental data scarcity and bias**. We see modern examples of large-scale dataset generation such as the Protein Data Bank, Human Cell Atlas, and the Materials Project. Are there other fields where AI can benefit most from consortium efforts to generate large-scale datasets? How far can models trained on limited experimental datasets take us and where are lab-in-the-loop strategies essential? To address this, we additionally introduce a **dataset proposal competition**. Our workshop will highlight common bottlenecks in developing AI methods across scientific application domains, and delve into solutions that can unlock progress across all of these domains.",https://ai4sciencecommunity.github.io/neurips25
New Perspectives in Graph Machine Learning,"Zhiyang Wang, Juan Cervino, Luana Ruiz, Alejandro Ribeiro, Stefanie Jegelka, Charilaos Kanatsoulis",Sun 7 Dec,8 a.m. PST — 5 p.m. PST,Exhibit Hall F,,https://newgraphperspectives.com/
Non-Euclidean Foundation Models and Geometric Learning: Advancing AI Beyond Euclidean Frameworks,"Menglin Yang, Neil He, Yifei Zhang, Weikang Qiu, Ngoc Bui, Jiahong Liu, Melanie Weber, Rex Ying",Sun 7 Dec,8 a.m. PST — 5 p.m. PST,Upper Level Room 8,"In the era of foundation models and Large Language Models (LLMs), Euclidean space is the de facto geometric setting of our machine learning architectures. However, recent literature has demonstrated that this choice comes with fundamental limitations. Non-Euclidean learning is quickly gaining traction. Non-Euclidean spaces, such as hyperbolic, spherical, and mixed-curvature spaces, have been shown to provide more efficient and effective representations for data with intrinsic geometric properties, like hierarchy, symmetry, and heterogeneity. Integrating foundation models with non-Euclidean spaces has great potential to enhance their ability to capture and model the underlying structures and relationships in complex real-world data, leading to better performance, generalization, and interpretability. This workshop focuses on the intersection of Non-Euclidean representation learning and Foundation Models, exploring its potential benefits, challenges, and future directions.",https://hyperboliclearning.github.io/events/neurips2025negelworkshop
UrbanAI: Harnessing Artificial Intelligence for Smart Cities,"Judah Goldfeder, Na Li, Donna Vakalis, Bianca Howard, Philippe Wyder, Bing Dong, Yoshua Bengio",Sun 7 Dec,8 a.m. PST — 5 p.m. PST,Upper Level Room 26AB,,
AI That Keeps Up: Workshop on Continual and Compatible Foundation Model Updates (CCFM),"Fartash Faghri, Jessica Echterhoff, Jeffrey Li, Saurabh Garg, Amal Rannen-Triki, Sayna Ebrahimi",Sun 7 Dec,8 a.m. PST — 5 p.m. PST,Upper Level Room 25ABC,"Foundation models, despite their impressive capabilities, face a critical challenge: they naturally become outdated. Trained on vast datasets, frequently updating these models is expensive. Crucially, these challenges extend beyond the scope of studies in traditional continual learning, as foundation models require rapid and scalable adaptation to dynamic global changes and the emergence of both generalized and specialized tasks. This workshop addresses the urgent need for up-to-date foundation models. We invite researchers to explore cost-effective methods for frequent updates and adaptation, minimizing forgetting and deterioration, ensuring a consistent user experience, and designing dynamic evaluations that remain relevant as models evolve.",https://sites.google.com/view/ccfm-neurips2025
Recent Advances in Time Series Foundation Models: Have We Reached the ‘BERT Moment’?,"Thomas Moreau, Romain Tavenard, Valentina Zantedeschi, Vasilii Feofanov, Ievgen Redko, Ambroise Odonnat",Sun 7 Dec,8 a.m. PST — 5 p.m. PST,Upper Level Room 3,"Foundation models (FMs) have achieved great success in NLP and vision, inspiring over 20 new time series FMs (TSFMs) in the past year. Despite promising results, studies show that carefully designed lightweight supervised baselines often match TSFM performance. Unlike NLP’s “BERT Moment,” TSFMs still require full fine-tuning to be competitive in real-world scenarios. Additionally, some tabular FMs rival TSFMs without being time series-specific. Recent benchmarks also provide mixed evidence: GIFT-Eval favors TSFMs, OpenTS shows statistical models outperforming deep learning on univariate data, and FoundTS finds supervised baselines on par with TSFMs. This workshop aims to bring together researchers to examine the gap between TSFM potential and real-world utility, and to identify benchmarks and applications where TSFMs can truly excel. The key topics of this workshop include, but are not limited to: - Benchmarking Foundation Models in Time Series, - Scaling Laws and Efficiency in Time Series Models, - Evaluating Transferability and Adaptability of Foundation Models, - Leveraging Foundation Models of Other Modalities for Time Series, - Unsupervised performance estimation of TSFMs, - Industrial Benchmarking of Time Series Foundation Models",https://berts-workshop.github.io/
