title,authors,date,time,location,abstract,website
ML x OR: Mathematical Foundations and Operational Integration of Machine Learning for Uncertainty-Aware Decision-Making,"Jose Blanchet, Jing Dong, Henry Lam, Min-hwan Oh, Qiaomin Xie, Yao Xie, Assaf Zeevi, Enlu Zhou",Sat 6 Dec,8 a.m. PST — 5 p.m. PST,Upper Level Room 26AB,"Much of traditional decision-making science is grounded in the mathematical formulations and analyses of structured systems to recommend decisions that are optimized, robust, and uncertainty-aware. This scientific approach, rooted in the field of Operations Research (OR), has evolved through decades of advancements in stochastic modeling, computational simulation and optimization, and exhibits key strengths in methodological rigor and uncertainty encoding. On the other hand, recent advances in the AI/ML space have eschewed this model-based paradigm and increasingly embraced, to great success, model-free algorithmic design frameworks. This workshop, which is the first NeurIPS workshop explicitly themed and structured on ML-OR synergization, aspires to present recent developments, challenges and emerging research to accelerate ML-OR synthesis. By integrating ML into established OR methodologies, we have the opportunities to produce more data-centric and adaptive solutions for complex decision-making tasks that could propel, in a much faster-paced manner, the frontier of ""optimality"" across many relevant applications. Concomitantly, the goal is also to explore how model-based principled OR approaches can help alleviate issues revolving around ""black box"" systems, and provide paths to enhance interpretability, trust, and performance analysis.",https://mlxor-workshop.github.io/
The First Workshop on Efficient Reasoning,"cheng Luo, Xinyu Yang, Simran Arora, Weijia Shi, Hanshi Sun, Songlin Yang, Luca Zancato, Jiawei Zhao",Sat 6 Dec,8 a.m. PST — 5 p.m. PST,Exhibit Hall F,"Recent progress in large reasoning models (LRMs), like OpenAI o1 and Deepseek R1, has been pivotal for tackling complex applications, from mathematical and code reasoning to advanced symbolic and agentic planning. Their success often relies on test-time scaling, which involves increasing the generation length or depth. However, these approaches incur significant efficiency bottlenecks during training and inference. To overcome these limitations, further advancements are needed in data, algorithms, and systems applicable across various domains, as exemplified by work such as s1, Z1, and verl. The proposed workshop will bring together researchers and practitioners to rethink efficient reasoning under tight compute, memory, latency, throughput, and cost budgets, with the goal of translating theoretical breakthroughs into practical, deployable solutions.",https://efficient-reasoning.github.io/
Imageomics: Discovering Biological Knowledge from Images Using AI,"Jianyang Gu, Sam Stevens, Zheda Mai, Kaiya Provost, Lily Weng, Sara Beery, Subhransu Maji, Anuj Karpatne, Ben Weinstein",Sat 6 Dec,8 a.m. PST — 5 p.m. PST,Upper Level Room 32AB,"Imageomics is an emerging interdisciplinary field at the crossroads of machine learning (ML), computer vision (CV), and biological sciences. It leverages visual data—from microscopic images of single-cell species to videos of megafauna—to extract and analyze biological information, specifically traits. By grounding ML models in existing scientific knowledge, Imageomics aims to make traits computable from images, facilitating insights into the evolution and function of living organisms. Imageomics poses research problems that resonate with the broad machine-learning community: multimodal representation learning, object detection and tracking, few-shot learning, imbalanced-class learning, video understanding, 3D modeling, hierarchical learning, etc. When people leverage ML tools to solve biological questions, the foundational bridges between ML and biological sciences also provide opportunities to address key challenges in ML, creating a virtuous cycle between the two fields.",https://imageomics.github.io/Imageomics-NeurIPS-2025/
Deep Learning for Code in the Agentic Era,"Zijian Wang, Giovanni Zappella, Qian Liu, Zora Wang, Wen-Ding Li, Wasi Uddin Ahmad, Binyuan Hui",Sat 6 Dec,8 a.m. PST — 5 p.m. PST,"Exhibit Hall G,H","Deep learning for code has progressed from focused tasks—such as completion, repair, synthesis, and explanation to tackling complex, end-to-end software–engineering problems. A key recent breakthrough is the rise of coding agents. Unlike single-shot models, these systems plan, reason, explore, and invoke external tools to assist throughout the software-development lifecycle: adding features, refactoring, debugging, finding vulnerabilities, optimizing performance, summarizing code, and answering repository-level questions. Their growing versatility demands rigorous evaluation and a deeper understanding of their capabilities, limits, risks, and broader social impact. Building on momentum from both academia and industry (e.g. Google, OpenAI, Anthropic, SWE-Agent, OpenHands), we propose the 4th Deep Learning for Code (DL4C) workshop with a dedicated focus on coding agents. This workshop will provide a timely forum where researchers and practitioners can design and stress-test robust coding agents, discover novel applications and emergent behaviors, establish principled benchmarks and evaluation methods, study human–agent collaboration at scale, and advance the responsible, safe deployment of autonomous coding tools.",https://dl4c.github.io
Generative AI in Finance,"Renyuan Xu, Randall Balestriero, Jiawei He, Yongjae Lee, Zhangyang ""Atlas"" Wang, Yu Yu, Yinbin Han",Sat 6 Dec,8 a.m. PST — 5 p.m. PST,Upper Level Room 3,"This workshop aims to foster cross-disciplinary collaboration at the intersection of generative AI and finance, a high-stakes domain where the integration of domain expertise is essential to the safe and effective deployment of machine learning technologies. Recent advances in generative models—ranging from large language models to diffusion and score-based generative architectures—have opened new frontiers for applications in finance, such as financial modeling, stress testing, scenario generation, automated financial services, and decision-making under uncertainty. The workshop will highlight theoretical advances, practical implementations, new opportunities, and open challenges that arise when adapting generative AI to financial systems under unique constraints, such as data sparsity, regulatory requirements, and highly non-stationary and adversarial environments. By bringing together the computer science community, financial researchers, industry practitioners, and regulators, we aim to catalyze interdisciplinary dialogue and accelerate the responsible development of generative AI tailored to the needs of finance and risk management.",https://sites.google.com/view/neurips-25-gen-ai-in-finance/home
MATH-AI: The 5th Workshop on Mathematical Reasoning and AI,"Kaiyu Yang, Sophia S. Han, Pan Lu, Wei Xiong, Eric Zelikman, Yong Lin, Zhizhen Qin, Soonho Kong, He He, Dawn Song, Sanjeev Arora",Sat 6 Dec,8 a.m. PST — 5 p.m. PST,Upper Level Ballroom 6A,,https://mathai2025.github.io/
"The Second Workshop on GenAI for Health: Potential, Trust, and Policy Compliance","Jiawei Xu, Tiange Xiang, Pranav Rajpurkar, Junyuan Hong, Changan Chen, Ehsan Adeli, Xiaoxiao Li, Georgios Pavlakos, Scott Delp, Fei-Fei Li, Ying Ding",Sat 6 Dec,8 a.m. PST — 5 p.m. PST,Upper Level Room 33ABC,"Generative AI (GenAI) has emerged as a transformative force in healthcare, yet public trust remains limited due to safety concerns and policy misalignment. Building on last year’s successful GenAI4Health workshop, the field has rapidly evolved from exploratory research to real-world clinical deployments, accompanied by FDA regulatory involvement and expanding global governance frameworks. This second workshop convenes machine learning researchers, healthcare professionals, and policy experts to address the critical intersection of GenAI innovation and regulatory compliance in health applications. We will examine trustworthiness challenges in large language models and multimodal foundation models, explore mitigation strategies, and foster dialogue between technical and policy communities. Our goal is to advance safe, effective, and ethically-compliant GenAI integration in healthcare systems, improving patient outcomes and clinical research capabilities.",https://genai4health.github.io/
Algorithmic Collective Action,"Elliot Creager, Nicholas Vincent, Celestine Mendler-Dünner, William Agnew, Hanlin Li, Ulrich Aïvodji",Sat 6 Dec,8 a.m. PST — 5 p.m. PST,Upper Level Room 4,"The study of collective action has a long history in economics and sociology as a way for groups of people to impact markets and the political arena. Algorithmic collective action focuses on the study of such coordinated efforts in algorithmically-mediated sociotechnical systems. How can participants of AI systems coordinate towards socially beneficial outcomes? We offer a platform to discuss new ideas and help define the foundational research directions for this emerging topic through interdisciplinary discussions between core ML researchers, scholars from the social sciences, community stakeholders and advocates.",https://acaworkshop.github.io/
"Lock-LLM Workshop: Prevent Unauthorized Knowledge Use from Large Language Models - Deep Dive into Un-Distillate, Un-Finetunable, Un-Compressible, Un-Editable, and Un-Usable","Tianlong Chen, Ang Li, Furong Huang, Avi Schwarzschild, Neil Gong, Bo Li, Yuxiong He",Sat 6 Dec,8 a.m. PST — 5 p.m. PST,Upper Level Room 1AB,"Large Language Models (LLMs) have emerged as transformative tools across research and industry, revolutionizing how we interact with information. However, their immense capabilities bring critical security challenges—the same features that drive innovation can be exploited for malicious purposes through unauthorized distillation, fine-tuning, compression, or editing. These vulnerabilities pose severe threats, including intellectual property theft, the generation of sophisticated disinformation, the bypass of safety alignments, and the erosion of user trust in AI systems. This workshop aims to bring together researchers and practitioners from academia and industry who are advancing the frontiers of LLM security and protection. We seek to confront the unauthorized use of LLMs head-on by exploring novel and robust mechanisms designed to make these models inherently resistant to exploitation while maintaining their beneficial capabilities. The workshop also hosts the 2025 TrustAI Rising Star Award. Topics of interest include, but are not limited to: 1. Un-Distillable LLMs: Preventing unauthorized model replication and intellectual property theft 2. Un-Finetunable LLMs: Resisting malicious parameter updates and behavior alterations 3. Un-Compressible LLMs: Maintaining model integrity against unauthorized compression 4. Un-Editable LLMs: Safeguarding against knowledge tampering and misinformation injection 5. Un-Usable LLMs: Ensuring traceability and preventing misuse through watermarking and verification",https://lock-llm.github.io/
Structured Probabilistic Inference and Generative Modeling,"Yuanqi Du, Dinghuai Zhang, Jiajun He, Heli Ben-Hamu, Francisco Vargas, Yunan Yang, Animashree Anandkumar, Arnaud Doucet, José Miguel Hernández-Lobato",Sat 6 Dec,8 a.m. PST — 5 p.m. PST,Upper Level Ballroom 20C,,https://spigmworkshopv3.github.io/
Foundation Models for the Brain and Body Workshop,"Mehdi Azabou, Cole Hurwitz, Sophia Sanborn, Sana Tonekaboni, Paul Scotti, Nanda H Krishna, Pierre Guetschel",Sat 6 Dec,8 a.m. PST — 5 p.m. PST,Upper Level Room 24ABC,,https://brainbodyfm-workshop.github.io
Biosecurity Safeguards for Generative AI,"ZAIXI ZHANG, Amrit Singh Bedi, Mengdi Wang, Ruofan Jin, Le Cong, Souradip Chakraborty, Alvaro Velasquez",Sat 6 Dec,8 a.m. PST — 5 p.m. PST,Upper Level Room 27AB,,
AI and ML for Next-Generation Wireless Communications and Networking (AI4NextG @ NeurIPS’25),"Cong Shen, Christopher Brinton, Gauri Joshi, Hyeji Kim, Osvaldo Simeone, Shiqiang Wang, Taesang Yoo, Jun Zhang",Sat 6 Dec,8 a.m. PST — 5 p.m. PST,Upper Level Room 10,"The field of wireless communications and networking is undergoing a paradigm shift, driven by the growing potential of Artificial Intelligence (AI) and Machine Learning (ML) to redefine traditional system design principles. This workshop aims to catalyze interest and foster collaboration between the AI/ML and wireless communications communities. The timing of this workshop is especially significant, as the next-generation (NextG) wireless standardization efforts (such as 6G and WiFi 9) are just getting started, with AI-native technologies expected to play a central role across all aspects of the wireless ecosystem – from radio access to network management and edge intelligence. NextG represents a foundational shift in global infrastructure, enabling ultra-fast, low-latency, and intelligent connectivity that will power future applications in AI, robotics, immersive environments, and autonomous systems. These technologies offer unprecedented opportunities to both drive and benefit many applications, from healthcare and transportation to industrial automation and environmental monitoring. The economic and societal implications are vast: NextG networks will underlie trillions in global GDP impact, bridge digital divides, and shape how billions of people interact with technology and each other in the decades to come. Despite the clear promise, a significant disconnect exists between the AI/ML and wireless research communities. AI/ML experts often lack an understanding of the unique physical, algorithmic, and architectural constraints inherent in wireless systems, while wireless researchers tend to adopt generic, off-the-shelf AI/ML models that are not optimized for the intricacies of wireless environments. Wireless environments are inherently dynamic, high-dimensional, and partially observable. These unique characteristics make them ideal testbeds for developing robust learning algorithms, particularly in areas like online learning, reinforcement learning, and in-context learning. At the same time, AI/ML techniques are becoming essential for managing the growing complexity of modern wireless networks, including resource allocation, interference mitigation, and cross-layer optimization. Bridging the gap between the two communities is not only necessary for meaningful technological advances but also critical for realizing the full societal impact of intelligent wireless systems. This workshop aims to bring together researchers and practitioners at the intersection of artificial intelligence (AI), machine learning (ML), and wireless to address the unique challenges and opportunities posed by Next-Generation (NextG) wireless systems. As the 6G era begins to take shape, AI-native designs have emerged as a cornerstone of wireless innovation, with the potential to transform the performance, efficiency, and adaptability of communication systems. The integration of AI/ML is poised to influence every layer of the network stack, from physical-layer signal processing to network control and resource management.",https://ai4nextg.github.io/
Machine Learning and the Physical Sciences,"Nicole Hartman, Garrett Merz, Vinicius Mikuni, Mariel Pettee, Sebastian Wagner-Carena, Antoine Wehenkel, Atilim Gunes Baydin, Kyle Cranmer, Siddharth Mishra-Sharma, Benjamin Nachman, Brian Nord, Savannah Thais",Sat 6 Dec,8 a.m. PST — 5 p.m. PST,Upper Level Ballroom 6CF,"The Machine Learning and the Physical Sciences (ML4PS) workshop at NeurIPS is a unique gathering space for the growing community spearheading cross-cutting research topics at the intersection of machine learning (ML) and the physical sciences (PS). This includes the applications of ML to problems in the physical sciences (ML for PS) as well as developments in ML motivated by physical insights (PS for ML). The physical sciences are defined inclusively, including but not limited to physics, astronomy, cosmology, chemistry, biophysics, materials science, and Earth science. Join us to discuss the latest research at the convergence of these fields!",https://ml4physicalsciences.github.io/
Reliable ML from Unreliable Data,"Andrew Ilyas, Alkis Kalavasis, Anay Mehrotra, Manolis Zampetakis",Sat 6 Dec,8 a.m. PST — 5 p.m. PST,Upper Level Room 2,"Distributions shift, chatbots get jail‑broken, users game algorithms — how do we build reliable machine learning when data are missing, corrupted, or strategically manipulated? This workshop bridges theory and practice to tackle these challenges, bringing together researchers working on distribution shift, adversarial robustness, and strategic behaviour to chart principled yet deployable solutions for Reliable ML from Unreliable Data.",https://reliablemlworkshop.github.io/
OPT 2025: Optimization for Machine Learning,"Cristóbal Guzmán, Courtney Paquette, Misha Belkin, Zakaria Mhammedi, Frederik Kunstner, Sebastian Stich",Sat 6 Dec,8 a.m. PST — 5 p.m. PST,Upper Level Ballroom 20A,"Optimization lies at the heart of many machine learning algorithms and enjoys great interest in our community. Indeed, this intimate relation of optimization with ML is the key motivation for the OPT series of workshops. We aim to foster discussion, discovery, and dissemination of state-of-the-art research in optimization relevant to ML. The focus of OPT 2025 is on ""Statistics Meets Optimization"". Since its inception, stochastic optimization has been grounded in statistical principles. Today, many of the most pressing challenges in machine learning—such as generalization bounds, the training dynamics of overparameterized models, and the development of generative models—are directly inspired by statistical thinking. At the same time, the scale and complexity of modern datasets, along with the increasingly rich model classes used to represent them, pose new questions about how optimization algorithms interact with these structures—both computationally and statistically. For example, what role do data symmetries play in shaping optimization trajectories? How do statistical properties of the data affect the adaptivity and efficiency of learning algorithms? And how can optimization approaches be designed to scale with data while still preserving desirable statistical behavior? OPT 2025 will explore these questions with the goal of building bridges between the statistics and optimization communities, and highlighting their shared impact on the theory and practice of machine learning. We are looking forward to seeing you all at OPT 2025, which will take place at the San Diego Convention Center!",https://opt-ml.org
AI for non-human animal communication,"Ellen Gilsenan-McMahon, Brittany Solano",Sat 6 Dec,8 a.m. PST — 5 p.m. PST,Upper Level Room 9,"The past few years have seen an unprecedented surge in both the availability of bioacoustic data and the sophistication of AI/machine learning models. This convergence presents a unique window of opportunity to revolutionize our understanding of animal communication and biodiversity. However, achieving this requires a conscious effort to integrate the disciplines of AI/Machine Learning and Ethology. This workshop will explore the intersection of artificial intelligence (AI) and bioacoustics, aiming to address challenges in processing complex bioacoustic data and interpreting animal signals in order to advance our understanding of non-human animal communication. Join us for a poster session, keynote talks and a panel discussion as we explore key opportunities to use AI to decipher animal languages and thus deepen our understanding of the natural world.",https://aiforanimalcomms.org/
Constrained Optimization for Machine Learning,"Juan Ramirez, Meraj Hashemizadeh, Ignacio Hounie, Juan Elenter, Katya Scheinberg, Alejandro Ribeiro, Simon Lacoste-Julien",Sun 7 Dec,8 a.m. PST — 5 p.m. PST,Upper Level Ballroom 6DE,"As AI systems are increasingly deployed in safety-critical domains—including credit scoring, medical diagnosis, and autonomous systems—there is a growing demand to ensure their fairness, safety, robustness, and interpretability, alongside stronger calls for regulation. Constrained optimization offers an accountable framework for enforcing these requirements by embedding them directly into the training process, steering models to satisfy explicit constraints. This framework facilitates compliance with regulatory, industry, or ethical standards, which can be easily verified by checking constraint satisfaction. This workshop explores constrained optimization as a principled method for enforcing desirable properties in machine learning models. It brings together experts in optimization, machine learning, and trustworthy AI to address the algorithmic and practical challenges of scaling constrained methods to modern deep learning settings, which are often large-scale, non-convex, and stochastic.",https://constrained-opt-ml.github.io/
Artificial Intelligence for Music: Where Creativity Meets Computation,"Hao-Wen Dong, Zachary Novack, Yung-Hsiang Lu, Kristen Yeon-Ji Yun, Benjamin Chou",Sun 7 Dec,8 a.m. PST — 5 p.m. PST,Upper Level Room 27AB,"This workshop explores the dynamic intersection of AI and music, a rapidly evolving field where creativity meets computation. The goal of this workshop is twofold: First, we aim to explore the latest advancements of AI’s applications for music, from analysis, creation, performance, production, retrieval to music education and therapy. Second, we aim to discuss the impacts and implications of AI in music, including AI’s impacts on the music industry, musician community, and music education as well as ethical, legal and societal implications of AI music and AI’s implications for future musicians.",https://aiformusicworkshop.github.io/
2nd Workshop on Multi-modal Foundation Models and Large Language Models for Life Sciences,"Pengtao Xie, James Zou, Le Song, Ruishan Liu, Aidong Zhang, Eran Segal, Wei Wang, Li Zhang",Sun 7 Dec,8 a.m. PST — 5 p.m. PST,Upper Level Room 31ABC,,https://nips2025fm4ls.github.io/index.html
Workshop on Scaling Environments for Agents,"Yuan He, Guohao Li, Yi R. (May) Fung, Qingyun Wang, Fangru Lin, Xingyue Huang, Alisia Lupidi, Yusheng Su, Ziyu Ye, Da Yin, Ziyi Yang, Jialin Yu, Sunando Sengupta, Rishabh Agarwal, Bernard Ghanem, Animashree Anandkumar, Philip Torr",Sun 7 Dec,8 a.m. PST — 5 p.m. PST,Upper Level Room 23ABC,"The development of intelligent agents – particularly those powered by large language models (LLMs) – has emphasized the critical role of environments in shaping agent behavior and capabilities, especially for achieving end-to-end autonomy. Environments are not merely testing grounds; they are dynamic, interactive contexts that serve as the essential ""data"" for agents to learn adaptive behavior, complex reasoning, and long-term decision-making skills. Just as scaling the model size, dataset size, and training computation has led to emergent capabilities in LLMs, scaling the structure, fidelity, and diversity of environments is one of the crucial dimensions in advancing agent intelligence. Moreover, recent advances in end-to-end reinforcement learning (RL), particularly when paired with LLM-based agents, have made it increasingly viable to train agents through sustained interaction. These agents can now acquire skills, strategies, and planning abilities through environmental feedback, rather than relying solely on imitation learning or static prompt engineering. As we move toward more autonomous, general-purpose agents, the need for scalable, richly interactive, and diverse environments has become both urgent and foundational.",https://sea-workshop.github.io
