session_id,title,url
S82016,Autonomous Networks: The New Brain of Telco Operations,https://www.nvidia.com/gtc/session-catalog/sessions/gtc26-s82016/
EX82093,Redefining Vector DB Management: Uniting Massive Scalab...,https://www.nvidia.com/gtc/session-catalog/sessions/gtc26-ex82093/
S82095,Innovating Liquid Cooling Solutions for New-Generation...,https://www.nvidia.com/gtc/session-catalog/sessions/gtc26-s82095/
S82096,"Sovereign World Models: Scaling AI Memory, Data Gravity...",https://www.nvidia.com/gtc/session-catalog/sessions/gtc26-s82096/
S82224,Vision to AI-Driven Software Engineering,https://www.nvidia.com/gtc/session-catalog/sessions/gtc26-s82224/
S82237,"Build Faster, Smarter AI Agents: Techniques for Scalabl...",https://www.nvidia.com/gtc/session-catalog/sessions/gtc26-s82237/
EX82251,Reverse Pitches: VC Pitches for Startups,https://www.nvidia.com/gtc/session-catalog/sessions/gtc26-ex82251/
S82264,Accelerating the Path to Production: The Evolution of E...,https://www.nvidia.com/gtc/session-catalog/sessions/gtc26-s82264/
S82317,How to Build an AI Cloud: From Site Selection to GPU Cl...,https://www.nvidia.com/gtc/session-catalog/sessions/gtc26-s82317/
S82344,Under the Hood of Building and Scaling AI-Native Applic...,https://www.nvidia.com/gtc/session-catalog/sessions/gtc26-s82344/
CWES82381,"Agentic AI II: Production Deployment, Safety and Scale",https://www.nvidia.com/gtc/session-catalog/sessions/gtc26-cwes82381/
EX82047,Building Sovereign AI: Scaling 100B+ Model Training on...,https://www.nvidia.com/gtc/session-catalog/sessions/gtc26-ex82047/
EX82049,Scaling the AI Factory: Eliminating Power and Thermal B...,https://www.nvidia.com/gtc/session-catalog/sessions/gtc26-ex82049/
S81884,オールフォトニクスネットワークとNVIDIA DynamoによるAIエージェント...,https://www.nvidia.com/gtc/session-catalog/sessions/gtc26-s81884/
EX82138,"Simply Build, Run, and Optimize Your NVIDIA AI Factorie...",https://www.nvidia.com/gtc/session-catalog/sessions/gtc26-ex82138/
S82285,Ozaki Scheme: Addressing the Accuracy Challenge in the...,https://www.nvidia.com/gtc/session-catalog/sessions/gtc26-s82285/
EX82450,Transforming Industry With Physical AI (Presented by Ag...,https://www.nvidia.com/gtc/session-catalog/sessions/gtc26-ex82450/
EX81895,Transform Data Center Economics With NVIDIA Grace- and...,https://www.nvidia.com/gtc/session-catalog/sessions/gtc26-ex81895/
EX82226,Scale a Thinking Enterprise on BlueVerse (Presented by...,https://www.nvidia.com/gtc/session-catalog/sessions/gtc26-ex82226/
EX82069,"Maximize Tokens-per-Watt With AI Factory Digital Twins,...",https://www.nvidia.com/gtc/session-catalog/sessions/gtc26-ex82069/
EX82178,Al + Quantum: Unlocking the Next Era of Scientific and...,https://www.nvidia.com/gtc/session-catalog/sessions/gtc26-ex82178/
S81827,NVIDIA NeMo を活用した半導体領域知識を組み込む小規模 LLM のファ...,https://www.nvidia.com/gtc/session-catalog/sessions/gtc26-s81827/
S81972,インタラクティブCFD最前線：Omniverseで体験するデジタルツインと都市シ...,https://www.nvidia.com/gtc/session-catalog/sessions/gtc26-s81972/
EX82260,"Simplifying high-density fiber cabling for AI PODs, imp...",https://www.nvidia.com/gtc/session-catalog/sessions/gtc26-ex82260/
EX82305,AI No Longer Benefits From High-Capacity SSDs—It Requir...,https://www.nvidia.com/gtc/session-catalog/sessions/gtc26-ex82305/
S81896,VLM・VSSによる現場の安全性向上と作業効率向上の実現,https://www.nvidia.com/gtc/session-catalog/sessions/gtc26-s81896/
S81964,NVIDIA サービスを活用し、LLM の精度向上からフィジカル AI への応用...,https://www.nvidia.com/gtc/session-catalog/sessions/gtc26-s81964/
S81891,ファインチューニングによる金融領域に特化したVertical LLMの実現,https://www.nvidia.com/gtc/session-catalog/sessions/gtc26-s81891/
S81893,次世代GPU基盤の実力とサービス価値 NVIDIA HGX B300とNVIDI...,https://www.nvidia.com/gtc/session-catalog/sessions/gtc26-s81893/
S81897,NVIDIA Cosmosを活用した自動運転向けデータセット基盤の実装事例,https://www.nvidia.com/gtc/session-catalog/sessions/gtc26-s81897/
S81963,NVIDIAソフトウェアとの統合により進化する富士通の自律型AIプラットフォーム,https://www.nvidia.com/gtc/session-catalog/sessions/gtc26-s81963/
S81513,The Generative AI Revolution: AI スーパーコンピ...,https://www.nvidia.com/gtc/session-catalog/sessions/gtc26-s81513/
S81703,NVIDIA NeMo Guardrails と Amazon Bedrock...,https://www.nvidia.com/gtc/session-catalog/sessions/gtc26-s81703/
S81712,複雑ドキュメント向けソブリンAI：日本の先端事例から学ぶ,https://www.nvidia.com/gtc/session-catalog/sessions/gtc26-s81712/
S81560,"Discover Top In-Demand Learning Paths Across Europe, th...",https://www.nvidia.com/gtc/session-catalog/sessions/gtc26-s81560/
S81902,Accelerate AI Through Open-Source Inference,https://www.nvidia.com/gtc/session-catalog/sessions/gtc26-s81902/
S82258,Engineering Medical-Grade Platforms for Real-Time AI,https://www.nvidia.com/gtc/session-catalog/sessions/gtc26-s82258/
S81985,Business Jet Customization Accelerated with an Enhanced...,https://www.nvidia.com/gtc/session-catalog/sessions/gtc26-s81985/
S81988,Spain's First Physical AI Lab: Empowering the Northern...,https://www.nvidia.com/gtc/session-catalog/sessions/gtc26-s81988/
S81552,Accelerate Operational Excellence Through NVIDIA Resili...,https://www.nvidia.com/gtc/session-catalog/sessions/gtc26-s81552/
S81720,From Code to Capital: Empowering Women Tech Founders,https://www.nvidia.com/gtc/session-catalog/sessions/gtc26-s81720/
DLIT81597,Using Reasoning VLAs to Develop Safer Autonomous Vehicl...,https://www.nvidia.com/gtc/session-catalog/sessions/gtc26-dlit81597/
DLIT81642,Accelerate Apache Spark With GPU and AI: A Hands-On Wor...,https://www.nvidia.com/gtc/session-catalog/sessions/gtc26-dlit81642/
DLIT81700,Accelerate Robot Learning With NVIDIA Isaac Lab and New...,https://www.nvidia.com/gtc/session-catalog/sessions/gtc26-dlit81700/
DLIT82021,Ultra Scale Runbook for PyTorch on NVIDIA GPUs for Trai...,https://www.nvidia.com/gtc/session-catalog/sessions/gtc26-dlit82021/
DLIT82143,High-Performance LLM Serving and Training with SGLang,https://www.nvidia.com/gtc/session-catalog/sessions/gtc26-dlit82143/
DLIT82183,Advanced Workload Orchestration With NVIDIA Run:AI,https://www.nvidia.com/gtc/session-catalog/sessions/gtc26-dlit82183/
CWES81733,The Vision AI Toolbox,https://www.nvidia.com/gtc/session-catalog/sessions/gtc26-cwes81733/
CWES81506,Accelerated Computing in Financial Services for Banking,https://www.nvidia.com/gtc/session-catalog/sessions/gtc26-cwes81506/
S81488,An Introduction to Robot Simulation,https://www.nvidia.com/gtc/session-catalog/sessions/gtc26-s81488/
S81531,Python All the Way Down: Speed-of-Light CUDA Without Le...,https://www.nvidia.com/gtc/session-catalog/sessions/gtc26-s81531/
S81551,"Safety Design, Detection, and Responsibility in the Age...",https://www.nvidia.com/gtc/session-catalog/sessions/gtc26-s81551/
S81553,Quick Start to Accelerated Quantum Supercomputing,https://www.nvidia.com/gtc/session-catalog/sessions/gtc26-s81553/
S81658,Best Practices for Hashmap Optimization on NVIDIA Grace...,https://www.nvidia.com/gtc/session-catalog/sessions/gtc26-s81658/
S81659,The AI-Native Digital Health Stack: A Developer's Guide...,https://www.nvidia.com/gtc/session-catalog/sessions/gtc26-s81659/
S81666,Maximize Memory Bandwidth on Modern GPUs: Practical Tec...,https://www.nvidia.com/gtc/session-catalog/sessions/gtc26-s81666/
S81729,Unified Architectures and Evaluation Frameworks for Fin...,https://www.nvidia.com/gtc/session-catalog/sessions/gtc26-s81729/
S81742,Next-Generation Intelligent Surgical Robots,https://www.nvidia.com/gtc/session-catalog/sessions/gtc26-s81742/
S82023,"Building America’s AI-Native 6G: Architecture, Timeline...",https://www.nvidia.com/gtc/session-catalog/sessions/gtc26-s82023/
S82052,"The 2026 Infrastructure, Operations, and Cloud Services...",https://www.nvidia.com/gtc/session-catalog/sessions/gtc26-s82052/
S82103,Turn Your Data Estate Into AI Fuel (Presented by NetApp...,https://www.nvidia.com/gtc/session-catalog/sessions/gtc26-s82103/
S82148,Data Analytics and Streaming Media,https://www.nvidia.com/gtc/session-catalog/sessions/gtc26-s82148/
S82151,Deploy Lambda’s Bare Metal Cloud with NVIDIA Vera Rubin...,https://www.nvidia.com/gtc/session-catalog/sessions/gtc26-s82151/
S82156,Advancing AI and HPC Competency in Higher Education Thr...,https://www.nvidia.com/gtc/session-catalog/sessions/gtc26-s82156/
S82232,The Ecosystem Engine: Co-Creating the AI Factory (Prese...,https://www.nvidia.com/gtc/session-catalog/sessions/gtc26-s82232/
S82294,"Magic Attention: A Composable, State-of-the-Art Framewo...",https://www.nvidia.com/gtc/session-catalog/sessions/gtc26-s82294/
S82406,Powering Agentic AI in Automotive: From Enterprise and...,https://www.nvidia.com/gtc/session-catalog/sessions/gtc26-s82406/
S82432,Agentic AI 101,https://www.nvidia.com/gtc/session-catalog/sessions/gtc26-s82432/
CWES81461,Distributed Inference at Scale Using Dynamo,https://www.nvidia.com/gtc/session-catalog/sessions/gtc26-cwes81461/
S81422,Master AI Infrastructure At Scale: A DevOps Playbook,https://www.nvidia.com/gtc/session-catalog/sessions/gtc26-s81422/
CWES81474,"Automating AI Factory Infrastructure (Ansible, GitOps,...",https://www.nvidia.com/gtc/session-catalog/sessions/gtc26-cwes81474/
DLIT81545,Profiling Python and AI workloads with Nsight Compute,https://www.nvidia.com/gtc/session-catalog/sessions/gtc26-dlit81545/
S81548,Global Governance and the Future of AI Safety Regulatio...,https://www.nvidia.com/gtc/session-catalog/sessions/gtc26-s81548/
DLIT81567,Accelerating LLM Training and Inferencing With Reduced...,https://www.nvidia.com/gtc/session-catalog/sessions/gtc26-dlit81567/
DLIT81572,Powering Specialized Agents: Architecting Synthetic Dat...,https://www.nvidia.com/gtc/session-catalog/sessions/gtc26-dlit81572/
S81599,Healthcare Reimagined: Bridging Digital Intelligence an...,https://www.nvidia.com/gtc/session-catalog/sessions/gtc26-s81599/
S81638,From Isolation to Integration: Evolving Confidential Co...,https://www.nvidia.com/gtc/session-catalog/sessions/gtc26-s81638/
S81664,"AI on the Front Lines of Healthcare: Unlock Clinical, O...",https://www.nvidia.com/gtc/session-catalog/sessions/gtc26-s81664/
DLIT81776,Adding Safety and Perception to Industrial Robots,https://www.nvidia.com/gtc/session-catalog/sessions/gtc26-dlit81776/
S81782,Building the Architecture of Advertising Intelligence:...,https://www.nvidia.com/gtc/session-catalog/sessions/gtc26-s81782/
S81977,How HBM4 Unlocks Efficient LLM Serving at Scale (Presen...,https://www.nvidia.com/gtc/session-catalog/sessions/gtc26-s81977/
S82022,Wireless Network Digital Twins: Use Cases for 5G and 6G,https://www.nvidia.com/gtc/session-catalog/sessions/gtc26-s82022/
S82034,Build an AI-Ready Data Center: Practical Insights From...,https://www.nvidia.com/gtc/session-catalog/sessions/gtc26-s82034/
S82076,Architect for AI Breakthroughs: Co-Design Memory + Stor...,https://www.nvidia.com/gtc/session-catalog/sessions/gtc26-s82076/
S82079,Performance Without Compromise: How Memory Innovation i...,https://www.nvidia.com/gtc/session-catalog/sessions/gtc26-s82079/
S82166,AI Literacy at Scale: K-to-Career Access That Delivers...,https://www.nvidia.com/gtc/session-catalog/sessions/gtc26-s82166/
DLIT82292,Teach AI to Code in Every Language With NVIDIA NeMo,https://www.nvidia.com/gtc/session-catalog/sessions/gtc26-dlit82292/
S82302,AI-Powered Huge Ensembles for Portfolio Climate Risk Ma...,https://www.nvidia.com/gtc/session-catalog/sessions/gtc26-s82302/
S82370,Best Practices in Building and Packaging CUDA Python Li...,https://www.nvidia.com/gtc/session-catalog/sessions/gtc26-s82370/
DLIT82405,Inspecting Multimodal Data with Nemotron and Gemma 3,https://www.nvidia.com/gtc/session-catalog/sessions/gtc26-dlit82405/
S82446,Advancing Autonomous Vehicles With World Models,https://www.nvidia.com/gtc/session-catalog/sessions/gtc26-s82446/
S81628,MLOps 101: Platforms and Processes for Building AI,https://www.nvidia.com/gtc/session-catalog/sessions/gtc26-s81628/
CWES81524,"Connect With Cybersecurity, Agentic AI, and Threat Hunt...",https://www.nvidia.com/gtc/session-catalog/sessions/gtc26-cwes81524/
S81518,Optimize Mixture-Of-Experts for Low-Latency Inference D...,https://www.nvidia.com/gtc/session-catalog/sessions/gtc26-s81518/
S81559,Optimize Biologics Design Workflow With Auto-Tuned Mode...,https://www.nvidia.com/gtc/session-catalog/sessions/gtc26-s81559/
S81566,Climate Prediction and Smooth Navigation Use Cases,https://www.nvidia.com/gtc/session-catalog/sessions/gtc26-s81566/
S81581,Accelerate GPU Scientific Computing With nvmath-python,https://www.nvidia.com/gtc/session-catalog/sessions/gtc26-s81581/
CWES81600,Bridging the Real-to-Sim Gap with 3D Gaussian Splatting,https://www.nvidia.com/gtc/session-catalog/sessions/gtc26-cwes81600/
S81613,An Introduction to Newton Physics Engine for Robotics,https://www.nvidia.com/gtc/session-catalog/sessions/gtc26-s81613/
S81617,Scaling Trustworthy Multi-Modal Video Intelligence: A L...,https://www.nvidia.com/gtc/session-catalog/sessions/gtc26-s81617/
QA81637,PMPP Edition 5 Unveiled: Ask Dr. Wen Mei and the CUDA T...,https://www.nvidia.com/gtc/session-catalog/sessions/gtc26-qa81637/
S81821,Physical AI for Healthcare Robotics—Part 1: Simulation-...,https://www.nvidia.com/gtc/session-catalog/sessions/gtc26-s81821/
S81853,Enhance Data Center Efficiency and Throughput by Co-Sch...,https://www.nvidia.com/gtc/session-catalog/sessions/gtc26-s81853/
S81868,Decoding Quantum Errors With AI,https://www.nvidia.com/gtc/session-catalog/sessions/gtc26-s81868/
S81996,AI Performance and Inference Economics for Engineers,https://www.nvidia.com/gtc/session-catalog/sessions/gtc26-s81996/
S82141,Large-Scale JAX Training With Pipeline Parallelism,https://www.nvidia.com/gtc/session-catalog/sessions/gtc26-s82141/
S82158,High Performance AI-RAN Made Simple; Python to CUDA Sig...,https://www.nvidia.com/gtc/session-catalog/sessions/gtc26-s82158/
S82220,Close the Sim-to-Real Gap: Next-Gen Techniques for Synt...,https://www.nvidia.com/gtc/session-catalog/sessions/gtc26-s82220/
S82255,The Physics of Long-Context Inference: Breaking the Mem...,https://www.nvidia.com/gtc/session-catalog/sessions/gtc26-s82255/
S82299,Unlock Sovereign AI With Confidential RAG and Secure In...,https://www.nvidia.com/gtc/session-catalog/sessions/gtc26-s82299/
S82367,Building Sovereign AI Systems Under Real-World Constrai...,https://www.nvidia.com/gtc/session-catalog/sessions/gtc26-s82367/
CWES82408,Accelerate the AI Factory With NVIDIA-Certified Systems,https://www.nvidia.com/gtc/session-catalog/sessions/gtc26-cwes82408/
S82429,Deploy an AI Concierge for Every Customer at Global Sca...,https://www.nvidia.com/gtc/session-catalog/sessions/gtc26-s82429/
CWES81465,"How NVIDIA Can Help You, as a Researcher, Accelerate Sc...",https://www.nvidia.com/gtc/session-catalog/sessions/gtc26-cwes81465/
CWES81562,Harness the Potential and Navigate the Challenges of Ag...,https://www.nvidia.com/gtc/session-catalog/sessions/gtc26-cwes81562/
S81594,"Measuring Brand, Fame, and Virality Using Spatio-Tempor...",https://www.nvidia.com/gtc/session-catalog/sessions/gtc26-s81594/
S81634,"Workflow Revolution: How Doudna Drives HPC, AI, and Qua...",https://www.nvidia.com/gtc/session-catalog/sessions/gtc26-s81634/
CWES81670,Maximize Memory Bandwidth on Modern GPUs,https://www.nvidia.com/gtc/session-catalog/sessions/gtc26-cwes81670/
S81772,Don’t Leave Tensors on the Table: Programming and Optim...,https://www.nvidia.com/gtc/session-catalog/sessions/gtc26-s81772/
S81822,Physical AI for Healthcare Robotics—Part 2: Closing the...,https://www.nvidia.com/gtc/session-catalog/sessions/gtc26-s81822/
S81840,GPU Access to Unbounded Dataset Sizes Breaks Open Docum...,https://www.nvidia.com/gtc/session-catalog/sessions/gtc26-s81840/
S81875,Interactive Digital Twin for Fusion With Integrated Sen...,https://www.nvidia.com/gtc/session-catalog/sessions/gtc26-s81875/
CWES82063,Optimize NVFP4 Training and Inference at Scale Without...,https://www.nvidia.com/gtc/session-catalog/sessions/gtc26-cwes82063/
S82276,Standardize Gen AI Service Evaluation: An API-Centric B...,https://www.nvidia.com/gtc/session-catalog/sessions/gtc26-s82276/
S82413,How AI Systems Evolve Into Long-Horizon Agents,https://www.nvidia.com/gtc/session-catalog/sessions/gtc26-s82413/
S82452,Operationalizing AI at Scale: NVIDIA’s End‑to‑End Journ...,https://www.nvidia.com/gtc/session-catalog/sessions/gtc26-s82452/
EX82364,Life Sciences: Scale Multi‑Agent for Accelerated Clinic...,https://www.nvidia.com/gtc/session-catalog/sessions/gtc26-ex82364/
EX82378,Private AI: Run Modern Models On-Prem Without Moving Se...,https://www.nvidia.com/gtc/session-catalog/sessions/gtc26-ex82378/
EX82365,Making AI Agents Explainable for Manufacturing at Scale...,https://www.nvidia.com/gtc/session-catalog/sessions/gtc26-ex82365/
EX82385,"Make AI Factories Production-Ready: Inference, Networki...",https://www.nvidia.com/gtc/session-catalog/sessions/gtc26-ex82385/
C82415,Get NVIDIA-Certified at GTC for Free: Associate Certifi...,https://www.nvidia.com/gtc/session-catalog/sessions/gtc26-c82415/
DLIT81485,Hands-On With Earth-2: Building Local and National Weat...,https://www.nvidia.com/gtc/session-catalog/sessions/gtc26-dlit81485/
DLIT81757,Advance World Simulation With 3D Gaussian Splatting for...,https://www.nvidia.com/gtc/session-catalog/sessions/gtc26-dlit81757/
DLIT81808,Train and Deploy Contact-Rich Robot Manipulation Skills...,https://www.nvidia.com/gtc/session-catalog/sessions/gtc26-dlit81808/
DLIT81837,How to use NVIDIA Warp to Build GPU-Accelerated Computa...,https://www.nvidia.com/gtc/session-catalog/sessions/gtc26-dlit81837/
DLIT82150,Accelerate Video Frame Extraction and Labeling,https://www.nvidia.com/gtc/session-catalog/sessions/gtc26-dlit82150/
DLIT82311,Train and Test End-to-End Autonomous Vehicles with Alpa...,https://www.nvidia.com/gtc/session-catalog/sessions/gtc26-dlit82311/
EX82328,Liquid Cooling Readiness for Vera-Rubin Reference Archi...,https://www.nvidia.com/gtc/session-catalog/sessions/gtc26-ex82328/
EX82343,Designing Modular Infrastructure for the AI Factory Era...,https://www.nvidia.com/gtc/session-catalog/sessions/gtc26-ex82343/
EX82326,"How AI-Infused Platforms Redefine Modernization, Delive...",https://www.nvidia.com/gtc/session-catalog/sessions/gtc26-ex82326/
EX82377,From Smart Factory to Lights-Out Factory: Operationaliz...,https://www.nvidia.com/gtc/session-catalog/sessions/gtc26-ex82377/
C82417,Get NVIDIA-Certified at GTC for Free: Professional Cert...,https://www.nvidia.com/gtc/session-catalog/sessions/gtc26-c82417/
CWES81795,IGX and Jetson: Autonomous Robots and Physical AI Appli...,https://www.nvidia.com/gtc/session-catalog/sessions/gtc26-cwes81795/
S81462,Solve the Day 1 Challenge of Landing LLM Inference in E...,https://www.nvidia.com/gtc/session-catalog/sessions/gtc26-s81462/
S81478,How to Build End‑to‑End Physical AI Systems for Humanoi...,https://www.nvidia.com/gtc/session-catalog/sessions/gtc26-s81478/
S81693,Hardware-Efficient and Lossless Video Generation at Sca...,https://www.nvidia.com/gtc/session-catalog/sessions/gtc26-s81693/
S81709,Parameterized CUDA Graph Launch in PyTorch: CUDA Graphs...,https://www.nvidia.com/gtc/session-catalog/sessions/gtc26-s81709/
QA81741,Ask the Experts: Applications Built for Scale With cuPy...,https://www.nvidia.com/gtc/session-catalog/sessions/gtc26-qa81741/
S81831,AI Coding for the GPU: Build a Coding Agent to Help GPU...,https://www.nvidia.com/gtc/session-catalog/sessions/gtc26-s81831/
S82121,"Authorship Reimagined: AI, Art, and the Future of Creat...",https://www.nvidia.com/gtc/session-catalog/sessions/gtc26-s82121/
S82128,"Build, Optimize, Run: The Developer's Guide to Local Ge...",https://www.nvidia.com/gtc/session-catalog/sessions/gtc26-s82128/
CWES81471,Accelerate Your AI Infrastructure at Scale,https://www.nvidia.com/gtc/session-catalog/sessions/gtc26-cwes81471/
S81614,Top-K Selection at the Speed of Light,https://www.nvidia.com/gtc/session-catalog/sessions/gtc26-s81614/
S81640,Build a Software-Defined Multi-Tenant NVLinked Cluster,https://www.nvidia.com/gtc/session-catalog/sessions/gtc26-s81640/
QA82372,"What's in Your Developer Toolbox? CUDA, AI, and HPC Pro...",https://www.nvidia.com/gtc/session-catalog/sessions/gtc26-qa82372/
S82407,Break Communication Barriers: Scale AI and HPC with NCC...,https://www.nvidia.com/gtc/session-catalog/sessions/gtc26-s82407/
S82420,Orchestrate Next-Generation AI Workloads With Open-Sour...,https://www.nvidia.com/gtc/session-catalog/sessions/gtc26-s82420/
S82451,Expression About Expression: When AI Looks in the Mirro...,https://www.nvidia.com/gtc/session-catalog/sessions/gtc26-s82451/
P81027,Transolver and Transolver++: Accurate PDE Solvers on Mi...,https://www.nvidia.com/gtc/session-catalog/sessions/gtc26-p81027/
P81033,Next-Generation Storage Architecture With Compute-Stora...,https://www.nvidia.com/gtc/session-catalog/sessions/gtc26-p81033/
P81040,Detect Windshield Damage Using Physically Realistic Syn...,https://www.nvidia.com/gtc/session-catalog/sessions/gtc26-p81040/
P81041,Online Reasoning Video Segmentation with LLMs and Just-...,https://www.nvidia.com/gtc/session-catalog/sessions/gtc26-p81041/
P81042,LESS: Large Language Model Enhanced Semi-Supervised Lea...,https://www.nvidia.com/gtc/session-catalog/sessions/gtc26-p81042/
P81043,LightRV: An End-to-End Lightweight Training Solution fo...,https://www.nvidia.com/gtc/session-catalog/sessions/gtc26-p81043/
P81046,Next-Gen Hadoop Storage: BlueField-3 and CSAL for Perfo...,https://www.nvidia.com/gtc/session-catalog/sessions/gtc26-p81046/
P81053,Dual Engines of Thought: A Dual-Engine Architecture Wit...,https://www.nvidia.com/gtc/session-catalog/sessions/gtc26-p81053/
P81054,Reinforcement Learning for Follow-the-Leader Robotic En...,https://www.nvidia.com/gtc/session-catalog/sessions/gtc26-p81054/
P81055,Accelerate Topological Property Simulation of SSH–Hubba...,https://www.nvidia.com/gtc/session-catalog/sessions/gtc26-p81055/
P81056,Neural-Based High-Resolution Weather Localization in Th...,https://www.nvidia.com/gtc/session-catalog/sessions/gtc26-p81056/
P81059,Pioneering AI-Driven Engineering: Agentic Optimization...,https://www.nvidia.com/gtc/session-catalog/sessions/gtc26-p81059/
P81062,AI-Orchestrating Platform for Drug Repurposing,https://www.nvidia.com/gtc/session-catalog/sessions/gtc26-p81062/
P81065,S5-TTS: Low-Latency Streaming T5-based Text-to-Speech S...,https://www.nvidia.com/gtc/session-catalog/sessions/gtc26-p81065/
P81066,AI-Driven Rapid Diagnosis of Lymph Node Metastasis Duri...,https://www.nvidia.com/gtc/session-catalog/sessions/gtc26-p81066/
P81067,Learn Skill Abstraction From Action-Free Videos,https://www.nvidia.com/gtc/session-catalog/sessions/gtc26-p81067/
P81068,"Accelerated Quantum Supercomputing: Build a Multi-GPU,...",https://www.nvidia.com/gtc/session-catalog/sessions/gtc26-p81068/
P81070,Make Federated Learning Robust When Devices Join and Le...,https://www.nvidia.com/gtc/session-catalog/sessions/gtc26-p81070/
P81072,Accelerating High-Fidelity Generative Models: Entangled...,https://www.nvidia.com/gtc/session-catalog/sessions/gtc26-p81072/
P81075,Generative Antibody Factory: GPU-Accelerated Diffusion...,https://www.nvidia.com/gtc/session-catalog/sessions/gtc26-p81075/
P81084,Create Noninvasive Diagnoses: Adapting Digital-Twin Mod...,https://www.nvidia.com/gtc/session-catalog/sessions/gtc26-p81084/
P81085,Quantum-Inspired Kolmogorov–Arnold Networks for Scalabl...,https://www.nvidia.com/gtc/session-catalog/sessions/gtc26-p81085/
P81090,Continuous-Time NODE in Transformers and Physics-Inform...,https://www.nvidia.com/gtc/session-catalog/sessions/gtc26-p81090/
P81092,Polar Deep Learning on GPUs: Drone–Satellite Multispect...,https://www.nvidia.com/gtc/session-catalog/sessions/gtc26-p81092/
P81093,AI-Powered Digital Twin Transforms 7-Eleven Retail Stor...,https://www.nvidia.com/gtc/session-catalog/sessions/gtc26-p81093/
P81096,BrainRAD: Dementia Diagnosis and Prognosis Prediction W...,https://www.nvidia.com/gtc/session-catalog/sessions/gtc26-p81096/
P81097,Solving Sidewalk Autonomy Through Large-Scale Urban Sim...,https://www.nvidia.com/gtc/session-catalog/sessions/gtc26-p81097/
P81098,GPU Efficiency Optimization for Multi-Trillion Video Re...,https://www.nvidia.com/gtc/session-catalog/sessions/gtc26-p81098/
P81103,LeHome: A Simulation Environment for Deformable Object...,https://www.nvidia.com/gtc/session-catalog/sessions/gtc26-p81103/
P81105,Fast and Accurate Virtual Drug Screening Powered by GPU...,https://www.nvidia.com/gtc/session-catalog/sessions/gtc26-p81105/
P81106,BenchOverflow: Measuring Overflow in Large Language Mod...,https://www.nvidia.com/gtc/session-catalog/sessions/gtc26-p81106/
P81109,Disaggregated Inference Experiments With NVIDIA Dynamo...,https://www.nvidia.com/gtc/session-catalog/sessions/gtc26-p81109/
P81110,Interactive 2D–3D Visualization Interface for Digital P...,https://www.nvidia.com/gtc/session-catalog/sessions/gtc26-p81110/
P81117,Agentic AI for Medical Discharge: Combining Machine Lea...,https://www.nvidia.com/gtc/session-catalog/sessions/gtc26-p81117/
P81118,GreenMind: A LLM for Complex Reasoning — Chain-of-Thoug...,https://www.nvidia.com/gtc/session-catalog/sessions/gtc26-p81118/
P81119,AI Solves GPS Outages: Making Vehicle Navigation Robust,https://www.nvidia.com/gtc/session-catalog/sessions/gtc26-p81119/
