session_id,title,url
S81595,GTC 2026 Keynote,https://www.nvidia.com/gtc/session-catalog/sessions/gtc26-s81595/
S82167,Advancing to AI's Next Frontier: Insights From Jeff Dea...,https://www.nvidia.com/gtc/session-catalog/sessions/gtc26-s82167/
S81492,Disney’s Robotic Characters: From the Screen to Reality...,https://www.nvidia.com/gtc/session-catalog/sessions/gtc26-s81492/
S81645,From Concept to Production: Humanoid Robotics at Scale,https://www.nvidia.com/gtc/session-catalog/sessions/gtc26-s81645/
S81667,How Open World Models are Powering the Next Breakthroug...,https://www.nvidia.com/gtc/session-catalog/sessions/gtc26-s81667/
S81789,Open Source AI Shaping the Next Era of Intelligent Digi...,https://www.nvidia.com/gtc/session-catalog/sessions/gtc26-s81789/
S81612,Practical Context Engineering: Eliminate Bugs With High...,https://www.nvidia.com/gtc/session-catalog/sessions/gtc26-s81612/
S81493,Securing Coding Assistants,https://www.nvidia.com/gtc/session-catalog/sessions/gtc26-s81493/
S81911,The Engine of Innovation: How Accelerated Computing is...,https://www.nvidia.com/gtc/session-catalog/sessions/gtc26-s81911/
S81844,The Future of Industrial Edge,https://www.nvidia.com/gtc/session-catalog/sessions/gtc26-s81844/
S81598,Accelerate the Physical AI Era With Digital Twins and R...,https://www.nvidia.com/gtc/session-catalog/sessions/gtc26-s81598/
S81713,"Automotive Special Address: Advancing Level 4 Autonomy,...",https://www.nvidia.com/gtc/session-catalog/sessions/gtc26-s81713/
DLIW82209,Accelerated Networking for AI Infrastructure,https://www.nvidia.com/gtc/session-catalog/sessions/gtc26-dliw82209/
DLIW82265,Fundamentals of GPU-Accelerated Workflows with CUDA Pyt...,https://www.nvidia.com/gtc/session-catalog/sessions/gtc26-dliw82265/
DLIW82267,Adding New Knowledge to LLMs,https://www.nvidia.com/gtc/session-catalog/sessions/gtc26-dliw82267/
DLIW82268,Building Observable and Scalable Multi-Agent Workflows...,https://www.nvidia.com/gtc/session-catalog/sessions/gtc26-dliw82268/
DLIW82269,Building AI Agents with Multimodal Models,https://www.nvidia.com/gtc/session-catalog/sessions/gtc26-dliw82269/
DLIW82270,Building LLM Applications with Prompt Engineering,https://www.nvidia.com/gtc/session-catalog/sessions/gtc26-dliw82270/
DLIW82272,OpenUSD Crash Course: Build 3D Data Pipelines for Physi...,https://www.nvidia.com/gtc/session-catalog/sessions/gtc26-dliw82272/
DLIW82273,"How to Simulate, Train, Validate, and Deploy an End-to-...",https://www.nvidia.com/gtc/session-catalog/sessions/gtc26-dliw82273/
DLIW82274,Deploying and Optimizing AI Inference at Scale,https://www.nvidia.com/gtc/session-catalog/sessions/gtc26-dliw82274/
S81823,利用 NVIDIA Cosmos VSS 构建智慧交通（ITS）违章检测系统,https://www.nvidia.com/gtc/session-catalog/sessions/gtc26-s81823/
S81829,基于 verl 进行大模型强化学习的最佳实践,https://www.nvidia.com/gtc/session-catalog/sessions/gtc26-s81829/
S81969,利用 PhysicsNeMo 加速机器人中的柔性触觉传感器仿真,https://www.nvidia.com/gtc/session-catalog/sessions/gtc26-s81969/
S81939,面向灵巧操作的高效强化学习框架,https://www.nvidia.com/gtc/session-catalog/sessions/gtc26-s81939/
S81981,十载相伴，NVIDIA 赋能创业公司在 AI 时代加速前行,https://www.nvidia.com/gtc/session-catalog/sessions/gtc26-s81981/
S82284,ROLL：集成 NVIDIA Megatron、高效易用的大规模 LLM 强化学...,https://www.nvidia.com/gtc/session-catalog/sessions/gtc26-s82284/
S82354,基于 NVIDIA AI Enterprise 全栈赋能：“AI Factory...,https://www.nvidia.com/gtc/session-catalog/sessions/gtc26-s82354/
S81961,高速公路数字化转型——基于云边协同的 VLM 大模型行业长尾场景落地,https://www.nvidia.com/gtc/session-catalog/sessions/gtc26-s81961/
S81974,基于 NVIDIA 全栈技术打造代理式 AI 与物理 AI 的未来基石,https://www.nvidia.com/gtc/session-catalog/sessions/gtc26-s81974/
S82127,工业级具身智能，正在从概念走向现实,https://www.nvidia.com/gtc/session-catalog/sessions/gtc26-s82127/
S82283,面向大规模 Agent RL 的高并发沙箱系统构建与实践,https://www.nvidia.com/gtc/session-catalog/sessions/gtc26-s82283/
WP82017,Watch Party: 加速工業工程：AI 超級運算時代的產品設計與製造,https://www.nvidia.com/gtc/session-catalog/sessions/gtc26-wp82017/
S81577,通过触觉 AI 解锁高自由度灵巧操作,https://www.nvidia.com/gtc/session-catalog/sessions/gtc26-s81577/
S81900,AI 重塑影视产业：打造基于 NVIDIA 全栈的 AI 算力池，生成式 AI工...,https://www.nvidia.com/gtc/session-catalog/sessions/gtc26-s81900/
S81984,基于 NVIDIA HPC 打造端到端生成式推荐 OneRec 训练：面向工业级...,https://www.nvidia.com/gtc/session-catalog/sessions/gtc26-s81984/
S81846,洞察 2026 中国 AI 市场 — AI 智能体和物理 AI 浪潮下的创业风口,https://www.nvidia.com/gtc/session-catalog/sessions/gtc26-s81846/
S81858,基于具身智能加速即时物流机器人研发：从大语言动作模型训练到数字孪生验证,https://www.nvidia.com/gtc/session-catalog/sessions/gtc26-s81858/
S81883,多模态大模型训练的性能优化 Performance optimization f...,https://www.nvidia.com/gtc/session-catalog/sessions/gtc26-s81883/
S82281,LLM 如何赋能量化投资,https://www.nvidia.com/gtc/session-catalog/sessions/gtc26-s82281/
WP81561,Watch Party: 擴展規模與跨域：千兆級 AI 系統的網路創新,https://www.nvidia.com/gtc/session-catalog/sessions/gtc26-wp81561/
EX82045,Liquid-Cooled AI Server Platforms for Next-Generation P...,https://www.nvidia.com/gtc/session-catalog/sessions/gtc26-ex82045/
EX82205,Scale AI Data Pipelines With High-Capacity JBODs and NV...,https://www.nvidia.com/gtc/session-catalog/sessions/gtc26-ex82205/
DLIT81484,How to Run AI-Powered Computer-Aided Engineering Simula...,https://www.nvidia.com/gtc/session-catalog/sessions/gtc26-dlit81484/
DLIT81800,Assembling Industrial Digital Twins with OpenUSD and NV...,https://www.nvidia.com/gtc/session-catalog/sessions/gtc26-dlit81800/
DLIT81879,Create Vision AI Applications With Generative AI Coding...,https://www.nvidia.com/gtc/session-catalog/sessions/gtc26-dlit81879/
DLIT81936,Fine-Tune a Telco Reasoning Model: A Guide to Synthetic...,https://www.nvidia.com/gtc/session-catalog/sessions/gtc26-dlit81936/
EX82039,"Synergy at Scale: Unify Compute, Power and Cooling (Pre...",https://www.nvidia.com/gtc/session-catalog/sessions/gtc26-ex82039/
EX82286,The Agentic AI Data Factory: Why Agents Need a GPU-Nati...,https://www.nvidia.com/gtc/session-catalog/sessions/gtc26-ex82286/
EX82085,Advance AI Data Center Infrastructure Design and Constr...,https://www.nvidia.com/gtc/session-catalog/sessions/gtc26-ex82085/
EX82046,"Practical Applications of NVIDIA 3 Computers in Vision,...",https://www.nvidia.com/gtc/session-catalog/sessions/gtc26-ex82046/
EX82253,Supercharging Postgres for Agentic Analytics with NVIDI...,https://www.nvidia.com/gtc/session-catalog/sessions/gtc26-ex82253/
CWES81440,Leverage Acceleration for AI and HPC in Algorithmic Tra...,https://www.nvidia.com/gtc/session-catalog/sessions/gtc26-cwes81440/
S81561,Scaling Out and Across: Networking Innovations for Giga...,https://www.nvidia.com/gtc/session-catalog/sessions/gtc26-s81561/
S81564,AI-First Design: Build Smarter From Day Zero Through Ev...,https://www.nvidia.com/gtc/session-catalog/sessions/gtc26-s81564/
S81633,Scale Sports Intelligence and Insight With Foundational...,https://www.nvidia.com/gtc/session-catalog/sessions/gtc26-s81633/
S81715,Turning Models Into Engines: The AI Factory Era,https://www.nvidia.com/gtc/session-catalog/sessions/gtc26-s81715/
S81717,Big Compute Powering the Energy Value Chain,https://www.nvidia.com/gtc/session-catalog/sessions/gtc26-s81717/
S81769,The Era of GPU Data Processing: From SQL to Search and...,https://www.nvidia.com/gtc/session-catalog/sessions/gtc26-s81769/
S81779,From Research to Production: How Alpamayo Accelerates A...,https://www.nvidia.com/gtc/session-catalog/sessions/gtc26-s81779/
S81804,Integrating AI and Quantum Computing to Accelerate the...,https://www.nvidia.com/gtc/session-catalog/sessions/gtc26-s81804/
S81806,"How Open Models, Agents, and Physical AI Are Fueling a...",https://www.nvidia.com/gtc/session-catalog/sessions/gtc26-s81806/
CWES81843,The Developer’s Roadmap to Physical AI: Bridging Digita...,https://www.nvidia.com/gtc/session-catalog/sessions/gtc26-cwes81843/
S81847,A Playbook – Operating Cloud AI Factories at Scale,https://www.nvidia.com/gtc/session-catalog/sessions/gtc26-s81847/
S81859,CUDA: New Features and Beyond,https://www.nvidia.com/gtc/session-catalog/sessions/gtc26-s81859/
S82017,Accelerating Industrial Engineering: From Product Desig...,https://www.nvidia.com/gtc/session-catalog/sessions/gtc26-s82017/
EX82054,Leverage the Power of Thor in Industrial Applications (...,https://www.nvidia.com/gtc/session-catalog/sessions/gtc26-ex82054/
S82057,Industrial Takeoff: Reinventing Operations with Physica...,https://www.nvidia.com/gtc/session-catalog/sessions/gtc26-s82057/
S82091,Improving AIDC Operational Efficiency with AI Hardware...,https://www.nvidia.com/gtc/session-catalog/sessions/gtc26-s82091/
S82200,Real Cloud Infrastructure for Real AI Workloads: Traini...,https://www.nvidia.com/gtc/session-catalog/sessions/gtc26-s82200/
S82289,Enable Seamless Human-Humanoid Collaboration in a Share...,https://www.nvidia.com/gtc/session-catalog/sessions/gtc26-s82289/
S82329,Transforming Retail Commerce and Supply Chain Operation...,https://www.nvidia.com/gtc/session-catalog/sessions/gtc26-s82329/
EX82340,Scale Engineering Innovation With AI-Enhanced and Accel...,https://www.nvidia.com/gtc/session-catalog/sessions/gtc26-ex82340/
S82368,Transform Enterprise Infrastructure and Unlock Efficien...,https://www.nvidia.com/gtc/session-catalog/sessions/gtc26-s82368/
S82435,Transform Data Into Intelligence: How AI and Open Model...,https://www.nvidia.com/gtc/session-catalog/sessions/gtc26-s82435/
EX82160,"A Safe, Efficient, and Scalable Approach to 800 VDC Arc...",https://www.nvidia.com/gtc/session-catalog/sessions/gtc26-ex82160/
EX82279,Who Owns Intelligence When AI Runs the World? (Presente...,https://www.nvidia.com/gtc/session-catalog/sessions/gtc26-ex82279/
EX82058,"Robotics in the Wild: What’s Real, What’s Not, and What...",https://www.nvidia.com/gtc/session-catalog/sessions/gtc26-ex82058/
EX82287,A Practical Playbook for Making AI Real: Bring Physical...,https://www.nvidia.com/gtc/session-catalog/sessions/gtc26-ex82287/
S81433,cuTile Programming,https://www.nvidia.com/gtc/session-catalog/sessions/gtc26-s81433/
S81508,Building and Scaling AI Factories With Digital Twins an...,https://www.nvidia.com/gtc/session-catalog/sessions/gtc26-s81508/
CWES81554,Real-World Federated Learning With NVIDIA FLARE,https://www.nvidia.com/gtc/session-catalog/sessions/gtc26-cwes81554/
S81557,Scalable AI Localization for Live Media Using NVIDIA Ho...,https://www.nvidia.com/gtc/session-catalog/sessions/gtc26-s81557/
S81563,"Unlock Fast, Cost-Effective Interactive Analytics on Ma...",https://www.nvidia.com/gtc/session-catalog/sessions/gtc26-s81563/
CWES81583,AI for Payments,https://www.nvidia.com/gtc/session-catalog/sessions/gtc26-cwes81583/
S81636,Building Shopify’s Commerce Foundation Models,https://www.nvidia.com/gtc/session-catalog/sessions/gtc26-s81636/
DLIT81639,Automate 3D Data Pipelines With USD Exchange SDK,https://www.nvidia.com/gtc/session-catalog/sessions/gtc26-dlit81639/
S81656,Optimizing the Shopping Experience at Amazon Ads With N...,https://www.nvidia.com/gtc/session-catalog/sessions/gtc26-s81656/
S81673,"Enable Enterprise AI Factories With Secure, High-Perfor...",https://www.nvidia.com/gtc/session-catalog/sessions/gtc26-s81673/
S81708,NVIDIA 101: From Chips to Software—How NVIDIA's AI Plat...,https://www.nvidia.com/gtc/session-catalog/sessions/gtc26-s81708/
DLIT81725,Develop Production Agents with Eval-Driven Design,https://www.nvidia.com/gtc/session-catalog/sessions/gtc26-dlit81725/
S81731,Build a High-Performance Research Cluster,https://www.nvidia.com/gtc/session-catalog/sessions/gtc26-s81731/
S81766,Accelerated HPC+AI Workflow Enables Live-Steering of Ve...,https://www.nvidia.com/gtc/session-catalog/sessions/gtc26-s81766/
DLIT81774,Build a Video Analytics AI Agent With Vision Language M...,https://www.nvidia.com/gtc/session-catalog/sessions/gtc26-dlit81774/
S81813,Reinventing Clinical Decision Support With Agentic AI a...,https://www.nvidia.com/gtc/session-catalog/sessions/gtc26-s81813/
S81842,Edge Computing 101: Introduction to Smart Edge and Auto...,https://www.nvidia.com/gtc/session-catalog/sessions/gtc26-s81842/
S82025,How Sony PlayStation Built a Multi-Tenant GPU Cluster t...,https://www.nvidia.com/gtc/session-catalog/sessions/gtc26-s82025/
S82042,Building the Enterprise AI Factory:  A Unified Stack Wi...,https://www.nvidia.com/gtc/session-catalog/sessions/gtc26-s82042/
EX82108,High-Performance Inference for Frontier AI Models (Pres...,https://www.nvidia.com/gtc/session-catalog/sessions/gtc26-ex82108/
S82182,Reinforcement Learning at Scale: Engineering the Next G...,https://www.nvidia.com/gtc/session-catalog/sessions/gtc26-s82182/
EX82195,AI-Accelerated Design: From Hyperscale Data Centers to...,https://www.nvidia.com/gtc/session-catalog/sessions/gtc26-ex82195/
S82217,Transform Enterprise AI and Connectivity From Cloud to...,https://www.nvidia.com/gtc/session-catalog/sessions/gtc26-s82217/
S82244,Blueprint for AI Scale: How Industry Architects Success...,https://www.nvidia.com/gtc/session-catalog/sessions/gtc26-s82244/
DLIT82259,Scalable and Resilient Training with Megatron-Bridge an...,https://www.nvidia.com/gtc/session-catalog/sessions/gtc26-dlit82259/
S82398,Reinvent Semiconductor Design With Microsoft Discovery...,https://www.nvidia.com/gtc/session-catalog/sessions/gtc26-s82398/
S82448,"Open, Trusted, and Observable: Deploying AI Agents at E...",https://www.nvidia.com/gtc/session-catalog/sessions/gtc26-s82448/
EX82009,Why the Data Center is Becoming the new Control Plane f...,https://www.nvidia.com/gtc/session-catalog/sessions/gtc26-ex82009/
EX82179,Own Your AI: Beat Frontier Models With Your Own Data (P...,https://www.nvidia.com/gtc/session-catalog/sessions/gtc26-ex82179/
EX82032,From Kernels to Clusters: How PyTorch Powers High-Perfo...,https://www.nvidia.com/gtc/session-catalog/sessions/gtc26-ex82032/
EX82089,Power Solution for NVIDIA Vera Rubin and 800 VDC AI Rac...,https://www.nvidia.com/gtc/session-catalog/sessions/gtc26-ex82089/
S81542,Cutting-Edge Molecular Dynamics on the Latest Multi-Nod...,https://www.nvidia.com/gtc/session-catalog/sessions/gtc26-s81542/
S81569,"Self-Coding Agents: Architectures, Data Flywheels, and...",https://www.nvidia.com/gtc/session-catalog/sessions/gtc26-s81569/
S81578,Architecting AI Systems That Power Business Growth in S...,https://www.nvidia.com/gtc/session-catalog/sessions/gtc26-s81578/
S81593,Advances in Decision Intelligence,https://www.nvidia.com/gtc/session-catalog/sessions/gtc26-s81593/
S81735,Think You Know AI? 25 Startups Prove You Wrong,https://www.nvidia.com/gtc/session-catalog/sessions/gtc26-s81735/
S81751,How AI is Changing the Scientific Method in Biology and...,https://www.nvidia.com/gtc/session-catalog/sessions/gtc26-s81751/
S81786,Shaping the Next Era of Autonomous Driving Through Safe...,https://www.nvidia.com/gtc/session-catalog/sessions/gtc26-s81786/
S81845,Drive Optimal Tokens per Watt on any AI Infrastructure...,https://www.nvidia.com/gtc/session-catalog/sessions/gtc26-s81845/
S81856,Inside NVIDIA DGX AI Factory: Accelerating Networking f...,https://www.nvidia.com/gtc/session-catalog/sessions/gtc26-s81856/
S81894,The Case for Block-Based Programming With cuTile and Tr...,https://www.nvidia.com/gtc/session-catalog/sessions/gtc26-s81894/
CWES81955,NVIDIA 101: From Chips to Software—How NVIDIA's AI Plat...,https://www.nvidia.com/gtc/session-catalog/sessions/gtc26-cwes81955/
S81957,From Signal to Strategy: Unlock Alpha With AI-Powered R...,https://www.nvidia.com/gtc/session-catalog/sessions/gtc26-s81957/
EX82084,Architecting AI-Ready Data Centers: Lessons From Leadin...,https://www.nvidia.com/gtc/session-catalog/sessions/gtc26-ex82084/
S82136,Architecting Trust: Design Secure and Sovereign AI Syst...,https://www.nvidia.com/gtc/session-catalog/sessions/gtc26-s82136/
S82137,The NVIDIA Solutions for Workstation/Data Center/Embedd...,https://www.nvidia.com/gtc/session-catalog/sessions/gtc26-s82137/
S82186,From Complexity to Confidence: Core-to-Edge Secure AI F...,https://www.nvidia.com/gtc/session-catalog/sessions/gtc26-s82186/
S82203,Build a GPU-Accelerated Database Engine With CUDA,https://www.nvidia.com/gtc/session-catalog/sessions/gtc26-s82203/
S82293,Driving National Growth Through Sovereign AI Investment,https://www.nvidia.com/gtc/session-catalog/sessions/gtc26-s82293/
S82316,Inside Pixar’s RenderMan: XPU Technology and Storytelli...,https://www.nvidia.com/gtc/session-catalog/sessions/gtc26-s82316/
S82356,Crack the Code: Enable AI Assistants for Massive C++ Co...,https://www.nvidia.com/gtc/session-catalog/sessions/gtc26-s82356/
EX82362,Building Proprietary Multi-Agentic AI Workflows for a C...,https://www.nvidia.com/gtc/session-catalog/sessions/gtc26-ex82362/
S82404,From Replacement to Enhancement: A Human-Centered Appro...,https://www.nvidia.com/gtc/session-catalog/sessions/gtc26-s82404/
S82419,GPU ♥ LPU: Everything You Wanted to Know,https://www.nvidia.com/gtc/session-catalog/sessions/gtc26-s82419/
S82455,Digital Twins at Scale: The New Retail Growth Infrastru...,https://www.nvidia.com/gtc/session-catalog/sessions/gtc26-s82455/
EX82219,Accelerate Physical AI with Simulation-Centric Data Eng...,https://www.nvidia.com/gtc/session-catalog/sessions/gtc26-ex82219/
EX82366,The Velocity of Volts: Hitachi and NVIDIA Bring Physica...,https://www.nvidia.com/gtc/session-catalog/sessions/gtc26-ex82366/
EX82170,Build and Productize an AI Factory: From Design to Depl...,https://www.nvidia.com/gtc/session-catalog/sessions/gtc26-ex82170/
EX82215,Gesture-Based Control of Heavy Equipment Using Simulati...,https://www.nvidia.com/gtc/session-catalog/sessions/gtc26-ex82215/
S81619,机器人仿真实战：从资产到真机部署的全流程讲解,https://www.nvidia.com/gtc/session-catalog/sessions/gtc26-s81619/
S81938,基于 DeepGEMM × FlashMLA × DeepEP 对 DeepSe...,https://www.nvidia.com/gtc/session-catalog/sessions/gtc26-s81938/
S81986,基于 NVIDIA Hopper 架构的 LLM 长文本推理场景性能优化实践和探...,https://www.nvidia.com/gtc/session-catalog/sessions/gtc26-s81986/
S82027,从云端到本地，重塑座舱AI,https://www.nvidia.com/gtc/session-catalog/sessions/gtc26-s82027/
WP81719,"Watch Party: Nemotron Unpacked: Build, Fine-Tune, and D...",https://www.nvidia.com/gtc/session-catalog/sessions/gtc26-wp81719/
WP81789,Watch Party: 開源 AI 塑造智慧數位勞工新時代,https://www.nvidia.com/gtc/session-catalog/sessions/gtc26-wp81789/
S81860,从 Isaac Gym 迁移到 Isaac Lab，及未来技术演进,https://www.nvidia.com/gtc/session-catalog/sessions/gtc26-s81860/
S81940,Qwen3-Omni：驱动下一代智能座舱的全模态交互引擎,https://www.nvidia.com/gtc/session-catalog/sessions/gtc26-s81940/
S81970,DiT 视频模型推理加速新方案：兼顾精度与效率的平衡之道,https://www.nvidia.com/gtc/session-catalog/sessions/gtc26-s81970/
WP81806,Watch Party: 開放模型、代理與物理 AI 如何驅動醫療創新飛輪,https://www.nvidia.com/gtc/session-catalog/sessions/gtc26-wp81806/
S81580,China AI Networking Day - 迎接 10 亿瓦级 AI 工...,https://www.nvidia.com/gtc/session-catalog/sessions/gtc26-s81580/
S81620,NVIDIA GPU 的 LLM 异步强化学习训练,https://www.nvidia.com/gtc/session-catalog/sessions/gtc26-s81620/
S81978,MindVLA-o1：开启全能范式——下一代统一视觉-语言-动作自动驾驶大模型探...,https://www.nvidia.com/gtc/session-catalog/sessions/gtc26-s81978/
S82278,如何迈过具身智能的 ChatGPT 时刻,https://www.nvidia.com/gtc/session-catalog/sessions/gtc26-s82278/
WP81862,Watch Party: Bringing Physical AI to Smart Spaces,https://www.nvidia.com/gtc/session-catalog/sessions/gtc26-wp81862/
WP81667,Watch Party: 開源世界模型如何驅動物理 AI 下一個突破,https://www.nvidia.com/gtc/session-catalog/sessions/gtc26-wp81667/
S82109,基于多模态端到端世界模型的智驾体验,https://www.nvidia.com/gtc/session-catalog/sessions/gtc26-s82109/
S82188,从物理近似到物理真实：基于真实物理参数的 Physical AI 合成数据基础设...,https://www.nvidia.com/gtc/session-catalog/sessions/gtc26-s82188/
S82321,SeamlessFlow：NVIDIA GPU 集群上基于 Megatron-C...,https://www.nvidia.com/gtc/session-catalog/sessions/gtc26-s82321/
S81899,AI Factories in Europe: Building the Foundations for Sc...,https://www.nvidia.com/gtc/session-catalog/sessions/gtc26-s81899/
S81942,Powering Research: Real Academic Use Cases With NVIDIA...,https://www.nvidia.com/gtc/session-catalog/sessions/gtc26-s81942/
S81944,AI 与工业的融合：探索工业具身智能新路径,https://www.nvidia.com/gtc/session-catalog/sessions/gtc26-s81944/
S81995,用基座模型重塑智能边界,https://www.nvidia.com/gtc/session-catalog/sessions/gtc26-s81995/
S82322,规模化架构：大语言模型持续学习的探索与实践 Architectures of S...,https://www.nvidia.com/gtc/session-catalog/sessions/gtc26-s82322/
WP81598,Watch Party: 利用數位孿生和即時模擬加速物理 AI 時代,https://www.nvidia.com/gtc/session-catalog/sessions/gtc26-wp81598/
WP81708,Watch Party: NVIDIA 101: From Chips to Software—How NVI...,https://www.nvidia.com/gtc/session-catalog/sessions/gtc26-wp81708/
S81627,AI in the Age of Regulation: Build Trust Through Compli...,https://www.nvidia.com/gtc/session-catalog/sessions/gtc26-s81627/
S81982,Revolutionize Automated Parcel Handling With Humanoid R...,https://www.nvidia.com/gtc/session-catalog/sessions/gtc26-s81982/
S82306,Teach AI to Code in Every Language With NVIDIA NeMo,https://www.nvidia.com/gtc/session-catalog/sessions/gtc26-s82306/
S81509,Build Physical Intelligence: Open Collaboration Across...,https://www.nvidia.com/gtc/session-catalog/sessions/gtc26-s81509/
S81941,Agentic Systems for End-to-End Surgical Workflows,https://www.nvidia.com/gtc/session-catalog/sessions/gtc26-s81941/
S82116,Customer-Centric Innovation in Automotive,https://www.nvidia.com/gtc/session-catalog/sessions/gtc26-s82116/
S81464,Medical Speech and Transcription Frontiers: Transformin...,https://www.nvidia.com/gtc/session-catalog/sessions/gtc26-s81464/
S81987,From Vision to Reality: Building AI Factories,https://www.nvidia.com/gtc/session-catalog/sessions/gtc26-s81987/
S82044,"Supercharging Responsible AI Innovation: Compute, Synth...",https://www.nvidia.com/gtc/session-catalog/sessions/gtc26-s82044/
S82175,Beyond the Black Box: Interpretability of LLMs in Finan...,https://www.nvidia.com/gtc/session-catalog/sessions/gtc26-s82175/
S81991,Venture Capitalist Reverse Pitch: EMEA,https://www.nvidia.com/gtc/session-catalog/sessions/gtc26-s81991/
DLIT81814,Build Agentic Workflows for Financial Applications,https://www.nvidia.com/gtc/session-catalog/sessions/gtc26-dlit81814/
DLIT81816,Build Robot-Ready Assets for Physically Accurate Simula...,https://www.nvidia.com/gtc/session-catalog/sessions/gtc26-dlit81816/
DLIT81861,"Compress, Cut, and Distill: The Latest Gen AI Model Com...",https://www.nvidia.com/gtc/session-catalog/sessions/gtc26-dlit81861/
DLIT82184,How to Provision and Install NVIDIA Run:AI,https://www.nvidia.com/gtc/session-catalog/sessions/gtc26-dlit82184/
C82414,NVIDIA Certification Overview: What You Need to Know,https://www.nvidia.com/gtc/session-catalog/sessions/gtc26-c82414/
S81424,"Achieve Truly Serverless GPUs With libfuse, CRIU, and C...",https://www.nvidia.com/gtc/session-catalog/sessions/gtc26-s81424/
S81491,Security for the AI-First Enterprise,https://www.nvidia.com/gtc/session-catalog/sessions/gtc26-s81491/
S81503,The State of the Art of Quantum Chemistry on GPUs: EXES...,https://www.nvidia.com/gtc/session-catalog/sessions/gtc26-s81503/
S81584,Autonomous AI Factories: A Technical Preview of Agent-N...,https://www.nvidia.com/gtc/session-catalog/sessions/gtc26-s81584/
S81590,Lower the Barriers: How New Tools Unlock GPU Accelerati...,https://www.nvidia.com/gtc/session-catalog/sessions/gtc26-s81590/
S81610,"The Agentic Revolution for Specialty Care, Powered by A...",https://www.nvidia.com/gtc/session-catalog/sessions/gtc26-s81610/
CWES81615,Inter-GPU Communication Techniques and Libraries for HP...,https://www.nvidia.com/gtc/session-catalog/sessions/gtc26-cwes81615/
S81623,Build High-Performance Financial AI: Achieve Microsecon...,https://www.nvidia.com/gtc/session-catalog/sessions/gtc26-s81623/
S81630,Beyond the Basics: OpenUSD for Advanced Physical AI Sim...,https://www.nvidia.com/gtc/session-catalog/sessions/gtc26-s81630/
CWES81649,AI For Science: Driving Innovation in Research Labs and...,https://www.nvidia.com/gtc/session-catalog/sessions/gtc26-cwes81649/
S81677,Building the Intelligent Control Plane for Medical Imag...,https://www.nvidia.com/gtc/session-catalog/sessions/gtc26-s81677/
S81690,Transform Content Delivery With Generative AI at the Ed...,https://www.nvidia.com/gtc/session-catalog/sessions/gtc26-s81690/
S81719,"Nemotron Unpacked: Build, Fine-Tune, and Deploy NVIDIA'...",https://www.nvidia.com/gtc/session-catalog/sessions/gtc26-s81719/
S81737,Game Agent Models: Pick and Perfect the Right AI Models...,https://www.nvidia.com/gtc/session-catalog/sessions/gtc26-s81737/
S81793,Build Gigascale AI Factories With Next-Generation Rack-...,https://www.nvidia.com/gtc/session-catalog/sessions/gtc26-s81793/
