session_id,title,url
WP81911,Watch Party: 創新引擎：加速運算如何重塑全球產業,https://www.nvidia.com/gtc/session-catalog/sessions/gtc26-wp81911/
S82202,端到端用于自动驾驶的强化认知（Reinforced Cognitive）框架,https://www.nvidia.com/gtc/session-catalog/sessions/gtc26-s82202/
S81971,基于 NVIDIA Isaac Sim 的 Genie Sim 3.0 仿真平台...,https://www.nvidia.com/gtc/session-catalog/sessions/gtc26-s81971/
S82360,基于全局 KV Cache 存储系统的高效 LLM 推理加速方案 Efficie...,https://www.nvidia.com/gtc/session-catalog/sessions/gtc26-s82360/
WP81573,Watch Party: Building the Future of Manufacturing,https://www.nvidia.com/gtc/session-catalog/sessions/gtc26-wp81573/
S82131,端到端模型部署：从 L2 到 L4 — Thor 如何加速 L4 技术栈与 Ro...,https://www.nvidia.com/gtc/session-catalog/sessions/gtc26-s82131/
S81979,基于扩散模型的具身智能：从统一理论到 GPU 加速的机器人策略 Diffusio...,https://www.nvidia.com/gtc/session-catalog/sessions/gtc26-s81979/
S82312,基于多模态数据湖的新一代人工智能应用：NVIDIA 工具链落地实践的深度洞察,https://www.nvidia.com/gtc/session-catalog/sessions/gtc26-s82312/
S81975,AIBOX + AIOS：构建生成式 AI 在智能汽车的端侧落地新范式,https://www.nvidia.com/gtc/session-catalog/sessions/gtc26-s81975/
S81867,From Data to Meaning: Vision-Language Models Shaping th...,https://www.nvidia.com/gtc/session-catalog/sessions/gtc26-s81867/
S81994,Model Builders at the Frontier of EMEA’s Open and Sover...,https://www.nvidia.com/gtc/session-catalog/sessions/gtc26-s81994/
S82282,PAI 集成 NVIDIA Physical AI：驱动数据合成、模型训练测评一...,https://www.nvidia.com/gtc/session-catalog/sessions/gtc26-s82282/
S82221,NVIDIA 加速辅助驾驶 2.0 时代 AI 定义汽车的大规模应用,https://www.nvidia.com/gtc/session-catalog/sessions/gtc26-s82221/
S81521,European Robotics Startup Showcase,https://www.nvidia.com/gtc/session-catalog/sessions/gtc26-s81521/
S81718,Agentic AI for the Next Generation of Financial Advisor...,https://www.nvidia.com/gtc/session-catalog/sessions/gtc26-s81718/
S81927,Neural Physics for AI-Powered Differentiable PDE-Solver...,https://www.nvidia.com/gtc/session-catalog/sessions/gtc26-s81927/
S82028,Accelerating Small Molecule Drug Discovery for Hard-to-...,https://www.nvidia.com/gtc/session-catalog/sessions/gtc26-s82028/
S82204,Manufacturing Intelligence: Agentic AI to Unlock the Ne...,https://www.nvidia.com/gtc/session-catalog/sessions/gtc26-s82204/
S81992,Beyond the Model: Driving Cutting-Edge Drug Discovery,https://www.nvidia.com/gtc/session-catalog/sessions/gtc26-s81992/
S81993,From Physical Vision Systems to OpenUSD: Building Digit...,https://www.nvidia.com/gtc/session-catalog/sessions/gtc26-s81993/
S82115,Optimizing $1 Trillion in Payments: From Contextual Ban...,https://www.nvidia.com/gtc/session-catalog/sessions/gtc26-s82115/
S81898,Europe’s AI Launchpad: Unlock Startup Growth Through So...,https://www.nvidia.com/gtc/session-catalog/sessions/gtc26-s81898/
S82230,Transform Data for Industrial Mobility Automation,https://www.nvidia.com/gtc/session-catalog/sessions/gtc26-s82230/
C81544,Your Learning Pathway: Get Certified for Career Success,https://www.nvidia.com/gtc/session-catalog/sessions/gtc26-c81544/
DLIT81541,Build Surgical and Medical Robotics With NVIDIA Isaac f...,https://www.nvidia.com/gtc/session-catalog/sessions/gtc26-dlit81541/
DLIT81660,Data to Decisions: GPU-Accelerated Decision Optimizatio...,https://www.nvidia.com/gtc/session-catalog/sessions/gtc26-dlit81660/
DLIT81698,Scalable Environment Setup and Policy Evaluation in Sim...,https://www.nvidia.com/gtc/session-catalog/sessions/gtc26-dlit81698/
DLIT81798,Building and Deploying Digital Twin Applications With O...,https://www.nvidia.com/gtc/session-catalog/sessions/gtc26-dlit81798/
C81931,Your Path to Physical AI and OpenUSD Certification at G...,https://www.nvidia.com/gtc/session-catalog/sessions/gtc26-c81931/
DLIT81945,Faster Together: Train and Deploy a Speculative Decodin...,https://www.nvidia.com/gtc/session-catalog/sessions/gtc26-dlit81945/
DLIT82008,Deploy and Customize Your AI Factory: Make Your AI Fact...,https://www.nvidia.com/gtc/session-catalog/sessions/gtc26-dlit82008/
S81421,Robust LLM Training Infrastructure at ByteDance,https://www.nvidia.com/gtc/session-catalog/sessions/gtc26-s81421/
S81475,Supercharging AI With Multi-Gigawatt AI Factories,https://www.nvidia.com/gtc/session-catalog/sessions/gtc26-s81475/
S81489,A New Paradigm: Verifiable AI,https://www.nvidia.com/gtc/session-catalog/sessions/gtc26-s81489/
S81515,Best Practices of Multi-Modal and Vision Generation Tra...,https://www.nvidia.com/gtc/session-catalog/sessions/gtc26-s81515/
S81528,Code with Context: Build an Agentic IDE that Truly Unde...,https://www.nvidia.com/gtc/session-catalog/sessions/gtc26-s81528/
S81543,Scalable Data Access for Next-Gen Algorithmic Trading,https://www.nvidia.com/gtc/session-catalog/sessions/gtc26-s81543/
CWES81586,Connect With the Experts on the Technology Behind DGX C...,https://www.nvidia.com/gtc/session-catalog/sessions/gtc26-cwes81586/
S81663,Accelerate the Path to In-Silico Life Sciences and Drug...,https://www.nvidia.com/gtc/session-catalog/sessions/gtc26-s81663/
S81675,Reimagining Store Operations at Scale to Accelerate Ret...,https://www.nvidia.com/gtc/session-catalog/sessions/gtc26-s81675/
S81684,"Diffusion Unlocked: Advanced Techniques for Training, I...",https://www.nvidia.com/gtc/session-catalog/sessions/gtc26-s81684/
S81685,Build Flexible and Secure Power Infrastructure for a Su...,https://www.nvidia.com/gtc/session-catalog/sessions/gtc26-s81685/
S81706,Evaluation-Driven Development: Best Practices for Build...,https://www.nvidia.com/gtc/session-catalog/sessions/gtc26-s81706/
CWES81771,How to Run and Optimize Your Workloads on the NVIDIA Gr...,https://www.nvidia.com/gtc/session-catalog/sessions/gtc26-cwes81771/
S81802,Foundation Models Revolutionize Molecular Dynamics Simu...,https://www.nvidia.com/gtc/session-catalog/sessions/gtc26-s81802/
S81811,"All the Precision, None of the Transistors",https://www.nvidia.com/gtc/session-catalog/sessions/gtc26-s81811/
CWES81886,CUDA on Windows and WSL,https://www.nvidia.com/gtc/session-catalog/sessions/gtc26-cwes81886/
S82010,AI Grid Explained: From Secure AI Factories to Distribu...,https://www.nvidia.com/gtc/session-catalog/sessions/gtc26-s82010/
S82018,Scaling the AI Life Cycle: Next-Gen Training and Infere...,https://www.nvidia.com/gtc/session-catalog/sessions/gtc26-s82018/
S82114,Build Trust at Scale: Governing AI Across Your Enterpri...,https://www.nvidia.com/gtc/session-catalog/sessions/gtc26-s82114/
S82130,Pioneering NVIDIA DGX GB300 Liquid-Cooled Deployment in...,https://www.nvidia.com/gtc/session-catalog/sessions/gtc26-s82130/
S82173,Turning Telecom Networks Into Sovereign AI-Ready Platfo...,https://www.nvidia.com/gtc/session-catalog/sessions/gtc26-s82173/
S82177,Secure Multi-Tenant AI: Sovereign Neo-Cloud Infrastruct...,https://www.nvidia.com/gtc/session-catalog/sessions/gtc26-s82177/
S82228,Distributed AI Computing From AI Factories to the Edge...,https://www.nvidia.com/gtc/session-catalog/sessions/gtc26-s82228/
CWES82298,Building L4 Autonomy,https://www.nvidia.com/gtc/session-catalog/sessions/gtc26-cwes82298/
CWES82338,Everything You Want to Ask About NVIDIA Enterprise Refe...,https://www.nvidia.com/gtc/session-catalog/sessions/gtc26-cwes82338/
S82411,Market Primitives for an Agentic Economy,https://www.nvidia.com/gtc/session-catalog/sessions/gtc26-s82411/
S82431,Scaling Deep Tabular: 360K Inferences per Second per GP...,https://www.nvidia.com/gtc/session-catalog/sessions/gtc26-s82431/
CWES81535,CUDA Developer Best Practices,https://www.nvidia.com/gtc/session-catalog/sessions/gtc26-cwes81535/
CWES81458,Everything You Wanted to Know About AI Factories!,https://www.nvidia.com/gtc/session-catalog/sessions/gtc26-cwes81458/
S81519,Best Practices for Scaling Inference,https://www.nvidia.com/gtc/session-catalog/sessions/gtc26-s81519/
S81533,Massive Parallelization of Subgraph Isomorphism for Sca...,https://www.nvidia.com/gtc/session-catalog/sessions/gtc26-s81533/
S81570,From Data to Decisions: Enabling AI Agents With Busines...,https://www.nvidia.com/gtc/session-catalog/sessions/gtc26-s81570/
DLIT81587,Accelerated Omics and Single-cell Analysis Using NVIDIA...,https://www.nvidia.com/gtc/session-catalog/sessions/gtc26-dlit81587/
DLIT81609,Build End-to-End Medical AI Workflows With NVIDIA Clara...,https://www.nvidia.com/gtc/session-catalog/sessions/gtc26-dlit81609/
DLIT81641,Find the Bottleneck: Optimize AI Pipelines With Nsight...,https://www.nvidia.com/gtc/session-catalog/sessions/gtc26-dlit81641/
S81652,Scaling Laws in Biology: Why Bigger Models Alone Aren’t...,https://www.nvidia.com/gtc/session-catalog/sessions/gtc26-s81652/
S81681,Revolutionizing Car Manufacturing: Inside AUDI's Fully...,https://www.nvidia.com/gtc/session-catalog/sessions/gtc26-s81681/
CWES81692,Unlock Peak Performance and Stability: End-to-End Bench...,https://www.nvidia.com/gtc/session-catalog/sessions/gtc26-cwes81692/
S81707,How to Teach Coding Agents Your Domain-Specific Languag...,https://www.nvidia.com/gtc/session-catalog/sessions/gtc26-s81707/
S81726,Puma’s Smart Stores: Agents and Digital Humans Redefine...,https://www.nvidia.com/gtc/session-catalog/sessions/gtc26-s81726/
DLIT81738,Deploy and Optimize LLMs and VLMs on NVIDIA Jetson Thor,https://www.nvidia.com/gtc/session-catalog/sessions/gtc26-dlit81738/
DLIT81764,Unlock Real-Time Financial Decisions With GPU-Accelerat...,https://www.nvidia.com/gtc/session-catalog/sessions/gtc26-dlit81764/
S81765,"Activate Always-On AI Security, From Cloud to Edge",https://www.nvidia.com/gtc/session-catalog/sessions/gtc26-s81765/
S81824,Pushing the Boundaries of CAE and EDA With NVIDIA cuDSS...,https://www.nvidia.com/gtc/session-catalog/sessions/gtc26-s81824/
S81871,Transforming Industrial Ops: Real-Time Forecasting and...,https://www.nvidia.com/gtc/session-catalog/sessions/gtc26-s81871/
CWES81905,Accelerate Data Compression and Decompression on GPUs w...,https://www.nvidia.com/gtc/session-catalog/sessions/gtc26-cwes81905/
DLIT82000,Split and Win: Dynamo's Prefill-Decode Disaggregation a...,https://www.nvidia.com/gtc/session-catalog/sessions/gtc26-dlit82000/
S82012,AI Grid Tokenomics: Powering Distributed AI Inference a...,https://www.nvidia.com/gtc/session-catalog/sessions/gtc26-s82012/
S82033,"Optimize KV Caches for LLM Inference: Dynamo KVBM, Flex...",https://www.nvidia.com/gtc/session-catalog/sessions/gtc26-s82033/
S82035,Scaling Toward Quantum-GPU Supercomputing,https://www.nvidia.com/gtc/session-catalog/sessions/gtc26-s82035/
S82100,Develop Physical AI Applications and Build Data Factori...,https://www.nvidia.com/gtc/session-catalog/sessions/gtc26-s82100/
S82168,Insights From NVIDIA Research,https://www.nvidia.com/gtc/session-catalog/sessions/gtc26-s82168/
S82176,How AI Factories Can Shift-left to Accelerate Infrastru...,https://www.nvidia.com/gtc/session-catalog/sessions/gtc26-s82176/
S82197,Build Custom Large-Scale Generative AI Models,https://www.nvidia.com/gtc/session-catalog/sessions/gtc26-s82197/
S82214,Megatron Core: Customer Stories on the Open-Source Trai...,https://www.nvidia.com/gtc/session-catalog/sessions/gtc26-s82214/
S82218,Accelerate Physical AI: An Integrated Solution for Rapi...,https://www.nvidia.com/gtc/session-catalog/sessions/gtc26-s82218/
S82334,Building Liquid-Cooled AI Cloud Gigafactories (Present...,https://www.nvidia.com/gtc/session-catalog/sessions/gtc26-s82334/
S82403,Category Theory in Commodities: Applying Sheaf-Based Gr...,https://www.nvidia.com/gtc/session-catalog/sessions/gtc26-s82403/
S81463,Achieve Peak Tensor Core Performance for GEMM on Blackw...,https://www.nvidia.com/gtc/session-catalog/sessions/gtc26-s81463/
CWES81473,Ask Us Anything About NVIDIA Mission Control,https://www.nvidia.com/gtc/session-catalog/sessions/gtc26-cwes81473/
CWES81540,"Scale MoE Training With Megatron Core: Features, Optimi...",https://www.nvidia.com/gtc/session-catalog/sessions/gtc26-cwes81540/
S81611,Beyond the Workcell: Scaling Robotics Workflows Across...,https://www.nvidia.com/gtc/session-catalog/sessions/gtc26-s81611/
S81629,Accelerate Power Grid Interconnection for Load and Gene...,https://www.nvidia.com/gtc/session-catalog/sessions/gtc26-s81629/
S81643,How Simulation and AI are Giving Life to Digital Twins...,https://www.nvidia.com/gtc/session-catalog/sessions/gtc26-s81643/
S81734,Powering Agentic Commerce with Open-Source AI: Easy to...,https://www.nvidia.com/gtc/session-catalog/sessions/gtc26-s81734/
S81778,The Creative OS: AI Built With Human Imagination at the...,https://www.nvidia.com/gtc/session-catalog/sessions/gtc26-s81778/
S81785,Speed Meets Safety: Accelerating Automotive Crash Simul...,https://www.nvidia.com/gtc/session-catalog/sessions/gtc26-s81785/
S81852,Enterprise AI at Speed: Simplifying AI Factory Deployme...,https://www.nvidia.com/gtc/session-catalog/sessions/gtc26-s81852/
S81885,Augmenting Industrial Operations with Factory Playback...,https://www.nvidia.com/gtc/session-catalog/sessions/gtc26-s81885/
CWES81910,GPU-Accelerated Image Processing and Data Loading With...,https://www.nvidia.com/gtc/session-catalog/sessions/gtc26-cwes81910/
S81953,Scaling Immersive Experiences: From Design Collaboratio...,https://www.nvidia.com/gtc/session-catalog/sessions/gtc26-s81953/
S82090,The 1 MW Rack and Going Beyond the Sidecar: Optimizing...,https://www.nvidia.com/gtc/session-catalog/sessions/gtc26-s82090/
S82171,AI-Driven Digital Twins Optimize Facility Simulation an...,https://www.nvidia.com/gtc/session-catalog/sessions/gtc26-s82171/
S82225,Maximize LLM Throughput and Improve GPU Efficiency,https://www.nvidia.com/gtc/session-catalog/sessions/gtc26-s82225/
S82229,Accelerate Industrial Intelligence: Practice Across Des...,https://www.nvidia.com/gtc/session-catalog/sessions/gtc26-s82229/
S82238,The 50-State Plan: Public-Private Models for AI Infrast...,https://www.nvidia.com/gtc/session-catalog/sessions/gtc26-s82238/
CWES82261,Unlock the Power of AI-Ready Data: Transform Your Enter...,https://www.nvidia.com/gtc/session-catalog/sessions/gtc26-cwes82261/
S82277,Australia’s Radical Shift in AI Infrastructure: Project...,https://www.nvidia.com/gtc/session-catalog/sessions/gtc26-s82277/
S82359,Use Reinforcement Learning to Turn AI Agents Into Conti...,https://www.nvidia.com/gtc/session-catalog/sessions/gtc26-s82359/
S82428,"Build Open Models That Read, See, and Listen",https://www.nvidia.com/gtc/session-catalog/sessions/gtc26-s82428/
S82453,AI Agents at Work for Retail: How Leading Brands are Ge...,https://www.nvidia.com/gtc/session-catalog/sessions/gtc26-s82453/
DLIT81550,Build Domain AI Agents that Accurately Use Tools with R...,https://www.nvidia.com/gtc/session-catalog/sessions/gtc26-dlit81550/
DLIT81592,"Advancing Multimodal Systems: Alignment, Information Ty...",https://www.nvidia.com/gtc/session-catalog/sessions/gtc26-dlit81592/
DLIT81644,Generate Synthetic Data for Physical AI with NVIDIA Cos...,https://www.nvidia.com/gtc/session-catalog/sessions/gtc26-dlit81644/
DLIT81650,Develop AI-Powered Operational Dashboards for Digital T...,https://www.nvidia.com/gtc/session-catalog/sessions/gtc26-dlit81650/
DLIT82181,How to Accelerate AI Workflows With NVIDIA Run:AI,https://www.nvidia.com/gtc/session-catalog/sessions/gtc26-dlit82181/
DLIT82308,Hands-On NVIDIA DGX Spark (Sponsored by GCL),https://www.nvidia.com/gtc/session-catalog/sessions/gtc26-dlit82308/
CWES81655,Build End-to-End Medical AI Workflows With NVIDIA Clara...,https://www.nvidia.com/gtc/session-catalog/sessions/gtc26-cwes81655/
S81470,Accelerate Native Sparse Attention Kernels on Blackwell...,https://www.nvidia.com/gtc/session-catalog/sessions/gtc26-s81470/
CWES81549,"What's in Your Developer Toolbox? CUDA, AI, and Graphic...",https://www.nvidia.com/gtc/session-catalog/sessions/gtc26-cwes81549/
S81556,Designing and Operating an Energy Efficient AI Factory,https://www.nvidia.com/gtc/session-catalog/sessions/gtc26-s81556/
CWES81626,From Sandbox to Scale: Build Production-Ready AI Agents...,https://www.nvidia.com/gtc/session-catalog/sessions/gtc26-cwes81626/
S81651,Develop a Real-Time Digital Twin for Rapid Automotive E...,https://www.nvidia.com/gtc/session-catalog/sessions/gtc26-s81651/
S81662,MLOps 202: From Models to Production AI Systems at Scal...,https://www.nvidia.com/gtc/session-catalog/sessions/gtc26-s81662/
S81701,How Perplexity AI Scales Real-Time Search With Breakthr...,https://www.nvidia.com/gtc/session-catalog/sessions/gtc26-s81701/
S81704,Voice-Native Agents: Rearchitecting Conversational AI w...,https://www.nvidia.com/gtc/session-catalog/sessions/gtc26-s81704/
S81722,Vibe Decoding Quantum Error Correction With CUDA-Q,https://www.nvidia.com/gtc/session-catalog/sessions/gtc26-s81722/
S81748,The AI-XR Co-Scientist Lab: How Stanford's LabOS is Acc...,https://www.nvidia.com/gtc/session-catalog/sessions/gtc26-s81748/
S81762,Supercharge LLM Inference With Dynamo,https://www.nvidia.com/gtc/session-catalog/sessions/gtc26-s81762/
S81780,Powering the AI Era in Genomics With Advanced Next-Gene...,https://www.nvidia.com/gtc/session-catalog/sessions/gtc26-s81780/
S81835,Build Trust and Discovery Through Open‑Source AI in Res...,https://www.nvidia.com/gtc/session-catalog/sessions/gtc26-s81835/
S81838,Extend Robot Perception With Industrial Safety Agents,https://www.nvidia.com/gtc/session-catalog/sessions/gtc26-s81838/
S81841,"Smart Agents, Safer Systems: Engineering AI for Trust a...",https://www.nvidia.com/gtc/session-catalog/sessions/gtc26-s81841/
S81863,A New Frontier for Vision AI with Expert Reasoning Agen...,https://www.nvidia.com/gtc/session-catalog/sessions/gtc26-s81863/
S82019,Sovereign AI for Telcos: Offtake Stories and Monetizati...,https://www.nvidia.com/gtc/session-catalog/sessions/gtc26-s82019/
S82061,Desk-to-Scale: Engineering Sovereign Financial Agents W...,https://www.nvidia.com/gtc/session-catalog/sessions/gtc26-s82061/
EX82133,Build AI Factories for Always-On Throughput and Maximum...,https://www.nvidia.com/gtc/session-catalog/sessions/gtc26-ex82133/
CWES82142,How to Design and Build Gigawatt Scale AI Factories,https://www.nvidia.com/gtc/session-catalog/sessions/gtc26-cwes82142/
S82153,Always-On Innovation: How Nasdaq Deploys AI in Mission-...,https://www.nvidia.com/gtc/session-catalog/sessions/gtc26-s82153/
S82172,Generative AI in Media & Entertainment,https://www.nvidia.com/gtc/session-catalog/sessions/gtc26-s82172/
S82187,Transforming Bottlenecks into Breakthroughs: Scaling Se...,https://www.nvidia.com/gtc/session-catalog/sessions/gtc26-s82187/
S82227,Liquid-Cooled AI for Next-Generation Platforms (Present...,https://www.nvidia.com/gtc/session-catalog/sessions/gtc26-s82227/
EX82249,NVIDIA Inception Presents: Startup Pitches,https://www.nvidia.com/gtc/session-catalog/sessions/gtc26-ex82249/
S82288,Revolutionize Warehouse and Shipping Operations Through...,https://www.nvidia.com/gtc/session-catalog/sessions/gtc26-s82288/
S82391,Enterprise AI Platforms and AI Agents to Business Value...,https://www.nvidia.com/gtc/session-catalog/sessions/gtc26-s82391/
EX81989,Building the Next Frontier for the World’s Largest Sove...,https://www.nvidia.com/gtc/session-catalog/sessions/gtc26-ex81989/
EX82315,No One Will Use Your AI Agents if They Don’t Feel Human...,https://www.nvidia.com/gtc/session-catalog/sessions/gtc26-ex82315/
CWES81591,Tile Programming for GPUs,https://www.nvidia.com/gtc/session-catalog/sessions/gtc26-cwes81591/
CWES81555,Leverage AI and Accelerated Computing for Digital Biolo...,https://www.nvidia.com/gtc/session-catalog/sessions/gtc26-cwes81555/
S81525,The Edge of the Edge: Redefining GPU-Enabled AI Sensor...,https://www.nvidia.com/gtc/session-catalog/sessions/gtc26-s81525/
S81537,Beyond Guardrails: Best Practices Across the Industry f...,https://www.nvidia.com/gtc/session-catalog/sessions/gtc26-s81537/
DLIT81579,Optimize PyTorch Models for High-Performance Inference...,https://www.nvidia.com/gtc/session-catalog/sessions/gtc26-dlit81579/
S81618,Build Next-Generation Foundation Models in Finance,https://www.nvidia.com/gtc/session-catalog/sessions/gtc26-s81618/
DLIT81668,Harness NVIDIA AI Advanced Tools for Generative AI in D...,https://www.nvidia.com/gtc/session-catalog/sessions/gtc26-dlit81668/
S81691,Securing the AI Factory: Accelerate Runtime Security fo...,https://www.nvidia.com/gtc/session-catalog/sessions/gtc26-s81691/
DLIT81699,Building and Testing Multi‑Robot Scenarios with Isaac S...,https://www.nvidia.com/gtc/session-catalog/sessions/gtc26-dlit81699/
S81705,Performance Optimization of cuTile Kernels,https://www.nvidia.com/gtc/session-catalog/sessions/gtc26-s81705/
S81745,Using Agentic AI to Transform Science: From Molecules t...,https://www.nvidia.com/gtc/session-catalog/sessions/gtc26-s81745/
S81752,"How NASCAR Uses GPU-Accelerated Simulation for Safer, M...",https://www.nvidia.com/gtc/session-catalog/sessions/gtc26-s81752/
CWES81819,Advance Physical AI Safety With NVIDIA Halos,https://www.nvidia.com/gtc/session-catalog/sessions/gtc26-cwes81819/
S81820,Leverage DL to Enable Blood-Based Multi-Cancer Detectio...,https://www.nvidia.com/gtc/session-catalog/sessions/gtc26-s81820/
S81866,Automating Vision and Reporting for Utility Inspections,https://www.nvidia.com/gtc/session-catalog/sessions/gtc26-s81866/
DLIT81881,Scaling Robotic AI Development from Prototype to Produc...,https://www.nvidia.com/gtc/session-catalog/sessions/gtc26-dlit81881/
DLIT82002,Efficient Workload Management for AI Factories: What Ev...,https://www.nvidia.com/gtc/session-catalog/sessions/gtc26-dlit82002/
S82005,The AI-Augmented Surgeon: Inside the Operating Room of...,https://www.nvidia.com/gtc/session-catalog/sessions/gtc26-s82005/
S82020,A Deep Dive Into Two Telco-Built Sovereign AI Clouds,https://www.nvidia.com/gtc/session-catalog/sessions/gtc26-s82020/
S82038,AI Factory in Action:  Achieving Agile Automation With...,https://www.nvidia.com/gtc/session-catalog/sessions/gtc26-s82038/
EX82048,Design an Enterprise-Grade Platform for Generative and...,https://www.nvidia.com/gtc/session-catalog/sessions/gtc26-ex82048/
DLIT82062,MLOps Best Practices: Build an AI Agent,https://www.nvidia.com/gtc/session-catalog/sessions/gtc26-dlit82062/
S82071,From AI Factories to the Edge: Architecting Distributed...,https://www.nvidia.com/gtc/session-catalog/sessions/gtc26-s82071/
S82081,Solving the Trust Dilemma by Ensuring Model and Data Pr...,https://www.nvidia.com/gtc/session-catalog/sessions/gtc26-s82081/
S82102,Physical AI at Scale: Turn Real-World Intelligence Into...,https://www.nvidia.com/gtc/session-catalog/sessions/gtc26-s82102/
S82144,Build and Deploy AI Models and Agents for Media & Enter...,https://www.nvidia.com/gtc/session-catalog/sessions/gtc26-s82144/
EX82250,NVIDIA Inception Presents: Startup Pitches,https://www.nvidia.com/gtc/session-catalog/sessions/gtc26-ex82250/
S82295,Realizing the Promise of Quantum Computation,https://www.nvidia.com/gtc/session-catalog/sessions/gtc26-s82295/
S82390,Redefining AI Performance: NVIDIA Blackwell on OCI Acce...,https://www.nvidia.com/gtc/session-catalog/sessions/gtc26-s82390/
S82416,Architects of the Accelerated Age: How CUDA Builders Ch...,https://www.nvidia.com/gtc/session-catalog/sessions/gtc26-s82416/
S82430,The New Compute Paradigm: Adapting Infrastructure for t...,https://www.nvidia.com/gtc/session-catalog/sessions/gtc26-s82430/
EX82083,From Silicon to Solution: Building a World-Class Infere...,https://www.nvidia.com/gtc/session-catalog/sessions/gtc26-ex82083/
EX82240,Why AI Platforms are Reclaiming Their GPU Infrastructur...,https://www.nvidia.com/gtc/session-catalog/sessions/gtc26-ex82240/
CWES81759,Quantum Computing and AI,https://www.nvidia.com/gtc/session-catalog/sessions/gtc26-cwes81759/
S81494,Securing AI Application: Red Teaming the Models and App...,https://www.nvidia.com/gtc/session-catalog/sessions/gtc26-s81494/
S81621,The Augmented Workforce: Build and Deploy AI Agents for...,https://www.nvidia.com/gtc/session-catalog/sessions/gtc26-s81621/
S81661,Introduction to Neural Rendering,https://www.nvidia.com/gtc/session-catalog/sessions/gtc26-s81661/
S81683,Accelerate Grid Modernization for AI Growth Using NVIDI...,https://www.nvidia.com/gtc/session-catalog/sessions/gtc26-s81683/
S81696,Quantum Computing at NERSC and Lawrence Berkeley Nation...,https://www.nvidia.com/gtc/session-catalog/sessions/gtc26-s81696/
S81736,From Concept to Capability: Scaling AI Surrogates Acros...,https://www.nvidia.com/gtc/session-catalog/sessions/gtc26-s81736/
S81747,Build Fault-Tolerant Distributed AI Training at Scale,https://www.nvidia.com/gtc/session-catalog/sessions/gtc26-s81747/
S81749,Robotic Automation in Neurosurgery Navigation With Isaa...,https://www.nvidia.com/gtc/session-catalog/sessions/gtc26-s81749/
S81763,AI Digital Twin of the Climate System,https://www.nvidia.com/gtc/session-catalog/sessions/gtc26-s81763/
S81781,Real-Time Science and Engineering With AI Physics and K...,https://www.nvidia.com/gtc/session-catalog/sessions/gtc26-s81781/
S81792,Accelerated Building Blocks for Next-Generation AI+HPC...,https://www.nvidia.com/gtc/session-catalog/sessions/gtc26-s81792/
S81797,Developing AI 2035: The Next Decade of Intelligence,https://www.nvidia.com/gtc/session-catalog/sessions/gtc26-s81797/
CWES81817,Best Practices in Building Your AI Factory: Connect Wit...,https://www.nvidia.com/gtc/session-catalog/sessions/gtc26-cwes81817/
S81826,Unlock Efficiency for Financial Agents With Scalable Da...,https://www.nvidia.com/gtc/session-catalog/sessions/gtc26-s81826/
