session_id,title,url
S81833,Optimize Performance of Vision AI Models on the Edge,https://www.nvidia.com/gtc/session-catalog/sessions/gtc26-s81833/
S81999,Immersive Robotics Teleop 101: Standardize Large-Scale...,https://www.nvidia.com/gtc/session-catalog/sessions/gtc26-s81999/
S82139,"From Idle to Optimized: Managing GPUs, Kubernetes, and...",https://www.nvidia.com/gtc/session-catalog/sessions/gtc26-s82139/
S82149,Take AV2.0 to the Next Level With End-to-End Embodied A...,https://www.nvidia.com/gtc/session-catalog/sessions/gtc26-s82149/
S82233,Solving the “Three Computer” Problem: Building the Clou...,https://www.nvidia.com/gtc/session-catalog/sessions/gtc26-s82233/
S82241,Unlocking Data at Scale for AI Factories (Presented by...,https://www.nvidia.com/gtc/session-catalog/sessions/gtc26-s82241/
S82423,Future of Enterprise AI: Infrastructure to Intelligence...,https://www.nvidia.com/gtc/session-catalog/sessions/gtc26-s82423/
DLIT81565,The Kaggle Grandmasters Playbook: Battle-Tested Modelin...,https://www.nvidia.com/gtc/session-catalog/sessions/gtc26-dlit81565/
S81632,Harness Agentic AI and Reasoning Models to Accelerate S...,https://www.nvidia.com/gtc/session-catalog/sessions/gtc26-s81632/
CWES81635,"Next-Generation Discovery: Agentic AI for Science, AI-D...",https://www.nvidia.com/gtc/session-catalog/sessions/gtc26-cwes81635/
S81653,LLM-Generated CUDA Kernels: Are We There Yet?,https://www.nvidia.com/gtc/session-catalog/sessions/gtc26-s81653/
S81674,"AI Agents, Robotics, and Digital Twins: The Full Stack...",https://www.nvidia.com/gtc/session-catalog/sessions/gtc26-s81674/
S81676,Reimagining the OR With Physical and Digital Robotics:...,https://www.nvidia.com/gtc/session-catalog/sessions/gtc26-s81676/
S81788,Accelerate Cloud Platforms for the Next Era of AI,https://www.nvidia.com/gtc/session-catalog/sessions/gtc26-s81788/
DLIT81803,OpenUSD Asset Integration and Data Review With Clash De...,https://www.nvidia.com/gtc/session-catalog/sessions/gtc26-dlit81803/
S81809,Achieving Gigascale AI: Insights From Infrastructure Vi...,https://www.nvidia.com/gtc/session-catalog/sessions/gtc26-s81809/
S81825,From Prompt to Pull Request: Engineering Coding Agents...,https://www.nvidia.com/gtc/session-catalog/sessions/gtc26-s81825/
S81834,Shaping the Future of Semiconductor Manufacturing With...,https://www.nvidia.com/gtc/session-catalog/sessions/gtc26-s81834/
S81836,Visual AI Agents for Real-Time Video Understanding,https://www.nvidia.com/gtc/session-catalog/sessions/gtc26-s81836/
CWES81912,Reinforcement Learning in the Modern AI Stack,https://www.nvidia.com/gtc/session-catalog/sessions/gtc26-cwes81912/
DLIT81958,Deploy State-of-the-Art Gen AI on Your RTX PRO Workstat...,https://www.nvidia.com/gtc/session-catalog/sessions/gtc26-dlit81958/
S82001,Deep Dive: Streaming Immersive Robotics Teleoperations,https://www.nvidia.com/gtc/session-catalog/sessions/gtc26-s82001/
DLIT82006,"Build Cost-Effective, Scalable RAG Pipelines: From Inge...",https://www.nvidia.com/gtc/session-catalog/sessions/gtc26-dlit82006/
S82088,A New Standard for Unified Power and Infrastructure Des...,https://www.nvidia.com/gtc/session-catalog/sessions/gtc26-s82088/
S82097,800 VDC and Modular Data Center Solutions: Powering Nex...,https://www.nvidia.com/gtc/session-catalog/sessions/gtc26-s82097/
S82113,Accelerate Open Science: Incorporating CUDA Into the Sc...,https://www.nvidia.com/gtc/session-catalog/sessions/gtc26-s82113/
S82132,The Blueprint for a Modern Resource-Responsible AI Fact...,https://www.nvidia.com/gtc/session-catalog/sessions/gtc26-s82132/
S82231,"Scaling the AI Factory With Full-Stack, Digitally Orche...",https://www.nvidia.com/gtc/session-catalog/sessions/gtc26-s82231/
S82243,Scale Foundation Models With Google Cloud AI Hypercompu...,https://www.nvidia.com/gtc/session-catalog/sessions/gtc26-s82243/
S82335,Reinvent Omnichannel Retail With Physical AI: Connect S...,https://www.nvidia.com/gtc/session-catalog/sessions/gtc26-s82335/
CWES82357,Accelerate Video Workloads Using NVENC/NVDEC Across Ga...,https://www.nvidia.com/gtc/session-catalog/sessions/gtc26-cwes82357/
S82409,Fast-Tracking the Launch of L4 Robotaxis Across the Glo...,https://www.nvidia.com/gtc/session-catalog/sessions/gtc26-s82409/
CWES81447,Unleashing AI at Scale: Meet the NVIDIA Networking Expe...,https://www.nvidia.com/gtc/session-catalog/sessions/gtc26-cwes81447/
S81523,Pioneering Autonomous Science: Toward a Unified Cross-L...,https://www.nvidia.com/gtc/session-catalog/sessions/gtc26-s81523/
S81547,Push the Performance Frontier of Computer Vision Models...,https://www.nvidia.com/gtc/session-catalog/sessions/gtc26-s81547/
S81573,Building the Future of Manufacturing,https://www.nvidia.com/gtc/session-catalog/sessions/gtc26-s81573/
S81624,Beauty Reinvented with L'Oréal: AI-Enabled Formulation...,https://www.nvidia.com/gtc/session-catalog/sessions/gtc26-s81624/
S81686,Quantum and HPC at Riken: The Sum is Greater Than Its P...,https://www.nvidia.com/gtc/session-catalog/sessions/gtc26-s81686/
S81695,Racing to the Top: How We Scaled Kimi K2,https://www.nvidia.com/gtc/session-catalog/sessions/gtc26-s81695/
S81711,Transforming the Automotive Industry With Industrial AI...,https://www.nvidia.com/gtc/session-catalog/sessions/gtc26-s81711/
S81743,The Digital Surgeon: How Generative AI and Simulation a...,https://www.nvidia.com/gtc/session-catalog/sessions/gtc26-s81743/
S81744,Real-time Voice Transformation with GPU Accelerated AI,https://www.nvidia.com/gtc/session-catalog/sessions/gtc26-s81744/
S81794,Drive Down Costs: Enhanced Tokenomics and Smart Routing...,https://www.nvidia.com/gtc/session-catalog/sessions/gtc26-s81794/
S81848,Deep Dive on Gigawatt AI Factories,https://www.nvidia.com/gtc/session-catalog/sessions/gtc26-s81848/
S81862,Bringing Physical AI to Smart Spaces,https://www.nvidia.com/gtc/session-catalog/sessions/gtc26-s81862/
S81870,Scaling DuckDB Beyond Its Limits: GPU-Accelerated Analy...,https://www.nvidia.com/gtc/session-catalog/sessions/gtc26-s81870/
CWES81997,Agentic Edge AI: Nemotron Training & Alignment Best Pra...,https://www.nvidia.com/gtc/session-catalog/sessions/gtc26-cwes81997/
S82003,Telecom Special Address: The AI Grid—Intelligently Conn...,https://www.nvidia.com/gtc/session-catalog/sessions/gtc26-s82003/
S82117,Scaling Trusted AI: A Hybrid Playbook for Impact in Fin...,https://www.nvidia.com/gtc/session-catalog/sessions/gtc26-s82117/
S82201,Deploy Reliable Agents at Scale With Reinforcement Lear...,https://www.nvidia.com/gtc/session-catalog/sessions/gtc26-s82201/
S82252,Fraud Prevention in the Age of Agentic Commerce,https://www.nvidia.com/gtc/session-catalog/sessions/gtc26-s82252/
S82262,AI Success Stories: Insights From the Frontlines (Prese...,https://www.nvidia.com/gtc/session-catalog/sessions/gtc26-s82262/
S82389,"OCI AI Infrastructure: Industry-Leading Scale, Performa...",https://www.nvidia.com/gtc/session-catalog/sessions/gtc26-s82389/
S81452,Building Frontier AI Models for eCommerce with the NVID...,https://www.nvidia.com/gtc/session-catalog/sessions/gtc26-s81452/
S81467,Graduate Fellowship Fast Forward Talks,https://www.nvidia.com/gtc/session-catalog/sessions/gtc26-s81467/
CWES81472,Build Industrial Digital Twins for the Era of Physical...,https://www.nvidia.com/gtc/session-catalog/sessions/gtc26-cwes81472/
S81479,Physical AI for the Real World: A Vision From NVIDIA Ro...,https://www.nvidia.com/gtc/session-catalog/sessions/gtc26-s81479/
S81522,Distillation Recipes and Synthetic Data Fine-Tuning for...,https://www.nvidia.com/gtc/session-catalog/sessions/gtc26-s81522/
CWES81538,"Multi-Modal RAG: Build Agentic AI Systems With Video, A...",https://www.nvidia.com/gtc/session-catalog/sessions/gtc26-cwes81538/
DLIT81546,Supercharge Tabular ML Models With GPU-Accelerated Feat...,https://www.nvidia.com/gtc/session-catalog/sessions/gtc26-dlit81546/
S81647,Harness AI to Accelerate Innovation in Healthcare Robot...,https://www.nvidia.com/gtc/session-catalog/sessions/gtc26-s81647/
S81678,How Snap Saves Millions with Accelerated Apache Spark,https://www.nvidia.com/gtc/session-catalog/sessions/gtc26-s81678/
CWES81679,Turbocharge Your LLM Inference: Expert Strategies for L...,https://www.nvidia.com/gtc/session-catalog/sessions/gtc26-cwes81679/
DLIT81697,Configure and Tune Robot Assets With OpenUSD and PhysX,https://www.nvidia.com/gtc/session-catalog/sessions/gtc26-dlit81697/
S81702,"Agentic AI Using Open Source Models: Finetuning, Deploy...",https://www.nvidia.com/gtc/session-catalog/sessions/gtc26-s81702/
S81750,Build the Future of AI Infrastructure With NVIDIA DOCA,https://www.nvidia.com/gtc/session-catalog/sessions/gtc26-s81750/
S81796,From Cluster to Factory: Scale AI Infrastructure Operat...,https://www.nvidia.com/gtc/session-catalog/sessions/gtc26-s81796/
DLIT81818,Tabular Foundation Models for Financial Services,https://www.nvidia.com/gtc/session-catalog/sessions/gtc26-dlit81818/
CWES82024,Voice Agent Applications and Models Development,https://www.nvidia.com/gtc/session-catalog/sessions/gtc26-cwes82024/
S82059,vLLM in 2026: Architectural Challenges and Performance...,https://www.nvidia.com/gtc/session-catalog/sessions/gtc26-s82059/
EX82087,Accelerating Rack-Scale Connectivity for NVIDIA Blackwe...,https://www.nvidia.com/gtc/session-catalog/sessions/gtc26-ex82087/
S82129,Engineering AI for Reality: From Readiness to Runtime (...,https://www.nvidia.com/gtc/session-catalog/sessions/gtc26-s82129/
S82146,Artist to Audience: The Developer Platform for Real-Tim...,https://www.nvidia.com/gtc/session-catalog/sessions/gtc26-s82146/
S82164,High-Performance Classical Control for Scaling Quantum...,https://www.nvidia.com/gtc/session-catalog/sessions/gtc26-s82164/
S82216,Architect the AI Factory for the NVIDIA Rubin Era: Scal...,https://www.nvidia.com/gtc/session-catalog/sessions/gtc26-s82216/
CWES82223,Robotics Teleoperation From the Web,https://www.nvidia.com/gtc/session-catalog/sessions/gtc26-cwes82223/
S82234,Scale Inference Using Open Models: How Nebius Token Fac...,https://www.nvidia.com/gtc/session-catalog/sessions/gtc26-s82234/
S82236,TACC Horizon System in the Converged World of HPC and A...,https://www.nvidia.com/gtc/session-catalog/sessions/gtc26-s82236/
EX82247,NVIDIA Inception Presents: Startup Pitches,https://www.nvidia.com/gtc/session-catalog/sessions/gtc26-ex82247/
S82271,Driving Factory Autonomy With Digital Twins: Hyundai’s...,https://www.nvidia.com/gtc/session-catalog/sessions/gtc26-s82271/
DLIT82342,Transform Massive Raw Data Into Diverse High-Quality Po...,https://www.nvidia.com/gtc/session-catalog/sessions/gtc26-dlit82342/
S82397,Bringing Sovereign AI From Ambition to a Strategic Foun...,https://www.nvidia.com/gtc/session-catalog/sessions/gtc26-s82397/
S82399,Design and Operate AI Factories at Hyperscale (Presente...,https://www.nvidia.com/gtc/session-catalog/sessions/gtc26-s82399/
S82437,"NVIDIA Vera: Reimagining CPUs for Agents, Reasoning, an...",https://www.nvidia.com/gtc/session-catalog/sessions/gtc26-s82437/
EX82257,"Building AI Factories for High-Assurance, Mission-Criti...",https://www.nvidia.com/gtc/session-catalog/sessions/gtc26-ex82257/
EX82307,Eliminate the Data Bottleneck: Accelerate Enterprise AI...,https://www.nvidia.com/gtc/session-catalog/sessions/gtc26-ex82307/
CWES81568,Build Smarter Robots Using NVIDIA Isaac Sim and Isaac L...,https://www.nvidia.com/gtc/session-catalog/sessions/gtc26-cwes81568/
CWES81740,A Deep Dive Into Omniverse Libraries for OpenUSD and Ph...,https://www.nvidia.com/gtc/session-catalog/sessions/gtc26-cwes81740/
CWES81457,From Foundation to Full-Throttle: Expert Advice on AI M...,https://www.nvidia.com/gtc/session-catalog/sessions/gtc26-cwes81457/
S81501,How Virtual Twins are Shaping the Next Industrial Revol...,https://www.nvidia.com/gtc/session-catalog/sessions/gtc26-s81501/
CWES81646,"MedTech: Physical AI for Imaging, Intervention, and Rob...",https://www.nvidia.com/gtc/session-catalog/sessions/gtc26-cwes81646/
S81657,MLOps 201: Master Operational Excellence With Agentic A...,https://www.nvidia.com/gtc/session-catalog/sessions/gtc26-s81657/
S81694,"Building, Measuring, and Using AI Scientists",https://www.nvidia.com/gtc/session-catalog/sessions/gtc26-s81694/
S81714,CSO Insights: Driving AI-Optimized Energy Efficiency an...,https://www.nvidia.com/gtc/session-catalog/sessions/gtc26-s81714/
S81739,"The AI behind Teammates, Ubisoft's Experimental Interac...",https://www.nvidia.com/gtc/session-catalog/sessions/gtc26-s81739/
CWES81756,"Next-Gen Digital Health Agents for Language, Speech, an...",https://www.nvidia.com/gtc/session-catalog/sessions/gtc26-cwes81756/
S81761,Agentic AI in Financial Services: Model Use Cases,https://www.nvidia.com/gtc/session-catalog/sessions/gtc26-s81761/
CWES81784,Master Immersive Real-Time Visual Process Understanding...,https://www.nvidia.com/gtc/session-catalog/sessions/gtc26-cwes81784/
S81810,AI Research Breakthroughs from NVIDIA Research (Hosted...,https://www.nvidia.com/gtc/session-catalog/sessions/gtc26-s81810/
S81828,Building an AI Factory to Power the Next Era of eCommer...,https://www.nvidia.com/gtc/session-catalog/sessions/gtc26-s81828/
S81830,From Challenge to Competitive Advantage: How VC Portfol...,https://www.nvidia.com/gtc/session-catalog/sessions/gtc26-s81830/
S81857,Accelerated AI Networking with DOCA,https://www.nvidia.com/gtc/session-catalog/sessions/gtc26-s81857/
S81873,Shatter the Memory Wall: Composable Building Blocks for...,https://www.nvidia.com/gtc/session-catalog/sessions/gtc26-s81873/
S81951,Inside Resilient AI Factories: How Predictive Analytics...,https://www.nvidia.com/gtc/session-catalog/sessions/gtc26-s81951/
S82014,AI Grid for Robots: Applications and Infrastructure for...,https://www.nvidia.com/gtc/session-catalog/sessions/gtc26-s82014/
S82026,Engineering Real-World LLM Inference: Bridging Open-Sou...,https://www.nvidia.com/gtc/session-catalog/sessions/gtc26-s82026/
S82043,Accelerate Hybrid Quantum-Classical Research at Scale W...,https://www.nvidia.com/gtc/session-catalog/sessions/gtc26-s82043/
S82074,How to Build Your Custom AI Advantage (Presented by Mis...,https://www.nvidia.com/gtc/session-catalog/sessions/gtc26-s82074/
S82080,"Accelerating Enterprise AI with NVIDIA: How SAP Builds,...",https://www.nvidia.com/gtc/session-catalog/sessions/gtc26-s82080/
EX82180,How AI Coding Augments IT Teams Without Replacing Them...,https://www.nvidia.com/gtc/session-catalog/sessions/gtc26-ex82180/
EX82248,Reverse Pitches: VC Pitches for Startups,https://www.nvidia.com/gtc/session-catalog/sessions/gtc26-ex82248/
S82355,Building the Future of AI Infrastructure: The HUMAIN-AW...,https://www.nvidia.com/gtc/session-catalog/sessions/gtc26-s82355/
S82395,The Sovereign Model Maker’s LLM Journey,https://www.nvidia.com/gtc/session-catalog/sessions/gtc26-s82395/
S82449,"Building the Future of Music and AI, With Sir Lucian Gr...",https://www.nvidia.com/gtc/session-catalog/sessions/gtc26-s82449/
EX82040,A Modular Blueprint for Next-Generation AI Servers: Ins...,https://www.nvidia.com/gtc/session-catalog/sessions/gtc26-ex82040/
EX82207,Tailor-Made Inference: Building SLA-Focused AI Stacks f...,https://www.nvidia.com/gtc/session-catalog/sessions/gtc26-ex82207/
CWES81481,Next-Gen Data Systems: GPU Acceleration for SQL and Vec...,https://www.nvidia.com/gtc/session-catalog/sessions/gtc26-cwes81481/
S81558,Post-Training Nemotron With RL: Multi‑Environment Train...,https://www.nvidia.com/gtc/session-catalog/sessions/gtc26-s81558/
S81622,"From Prototype to Playable: Bringing Scalable ML Into ""...",https://www.nvidia.com/gtc/session-catalog/sessions/gtc26-s81622/
S81680,From Grace to Vera: NVIDIA’s Next Arm-based Data Center...,https://www.nvidia.com/gtc/session-catalog/sessions/gtc26-s81680/
DLIT81682,Accelerate Drug Discovery With NVIDIA Libraries and Pla...,https://www.nvidia.com/gtc/session-catalog/sessions/gtc26-dlit81682/
S81689,Build Industrial-Scale Generative Recommenders with GPU...,https://www.nvidia.com/gtc/session-catalog/sessions/gtc26-s81689/
S81730,Leverage Physical AI to Simulate and Orchestrate Roboti...,https://www.nvidia.com/gtc/session-catalog/sessions/gtc26-s81730/
S81732,Accelerate Geospatial Workflows for Planetary Insight,https://www.nvidia.com/gtc/session-catalog/sessions/gtc26-s81732/
DLIT81754,From Ingestion to Inference: Mastering the High-Perform...,https://www.nvidia.com/gtc/session-catalog/sessions/gtc26-dlit81754/
S81767,Developing AI Physics Models for Spacecraft Reentry,https://www.nvidia.com/gtc/session-catalog/sessions/gtc26-s81767/
S81773,Accelerate AI Inference Using DOCA for Storage,https://www.nvidia.com/gtc/session-catalog/sessions/gtc26-s81773/
S81777,Strategic Capital and the Evolution of the AI Ecosystem,https://www.nvidia.com/gtc/session-catalog/sessions/gtc26-s81777/
S81790,An AI-Driven Autonomous Lab of the Future for Chemistry...,https://www.nvidia.com/gtc/session-catalog/sessions/gtc26-s81790/
DLIT81801,Real-Time Simulation for Real-Time Results: How AI Phys...,https://www.nvidia.com/gtc/session-catalog/sessions/gtc26-dlit81801/
S81805,Provide the Best Care for Patients Using Foundation Mod...,https://www.nvidia.com/gtc/session-catalog/sessions/gtc26-s81805/
S81851,The Builder’s Toolkit: Scaling Enterprise AI Factories,https://www.nvidia.com/gtc/session-catalog/sessions/gtc26-s81851/
DLIT81948,Create Generative AI Workflow for Design and Visualizat...,https://www.nvidia.com/gtc/session-catalog/sessions/gtc26-dlit81948/
CWES81960,Maximize GPU Resources in Your Virtualized Environment:...,https://www.nvidia.com/gtc/session-catalog/sessions/gtc26-cwes81960/
S81998,Accelerating Innovation With AI Studio and Foundry: Cas...,https://www.nvidia.com/gtc/session-catalog/sessions/gtc26-s81998/
S82004,Liquid Cooling: How to Achieve 100% Heat Capture on 500...,https://www.nvidia.com/gtc/session-catalog/sessions/gtc26-s82004/
S82011,AI Grid in Action: Killer Applications for Distributed...,https://www.nvidia.com/gtc/session-catalog/sessions/gtc26-s82011/
EX82041,Powering the AI Factory: From Platform Integration to S...,https://www.nvidia.com/gtc/session-catalog/sessions/gtc26-ex82041/
S82050,Empower US Manufacturing Through Wistron's Smart Manufa...,https://www.nvidia.com/gtc/session-catalog/sessions/gtc26-s82050/
S82065,"Five Bottlenecks, Five Fixes: How We Avoid Leaving Trai...",https://www.nvidia.com/gtc/session-catalog/sessions/gtc26-s82065/
EX82075,Securing Intelligence: A Practical Framework for AI and...,https://www.nvidia.com/gtc/session-catalog/sessions/gtc26-ex82075/
S82078,Transform Your Organization With End-to-End AIOps,https://www.nvidia.com/gtc/session-catalog/sessions/gtc26-s82078/
S82147,Simulating Reality Inside General World Models,https://www.nvidia.com/gtc/session-catalog/sessions/gtc26-s82147/
S82185,The Earth System at 1 km Resolution: Breaking Frontiers...,https://www.nvidia.com/gtc/session-catalog/sessions/gtc26-s82185/
S82341,Keeping Pace with F1: How AI Technology Drives Performa...,https://www.nvidia.com/gtc/session-catalog/sessions/gtc26-s82341/
S82418,"All Roads, All Rides: Technical Foundations for a Unive...",https://www.nvidia.com/gtc/session-catalog/sessions/gtc26-s82418/
EX82068,Unlock AI Performance: Three Ways CXL-Powered KV Cache...,https://www.nvidia.com/gtc/session-catalog/sessions/gtc26-ex82068/
EX82291,Build Self-Learning Agents on Cloudflare (Presented by...,https://www.nvidia.com/gtc/session-catalog/sessions/gtc26-ex82291/
EX82309,The Data Storage Platform That Powers AI Factories (Pre...,https://www.nvidia.com/gtc/session-catalog/sessions/gtc26-ex82309/
EX82327,Infosys Topaz Fabric With its Agentic Capabilities (Pre...,https://www.nvidia.com/gtc/session-catalog/sessions/gtc26-ex82327/
S81490,Building the Next Wave of AI-Enabled Robots,https://www.nvidia.com/gtc/session-catalog/sessions/gtc26-s81490/
S81512,Build an Open Surgery Robot AI Platform With NVIDIA Fra...,https://www.nvidia.com/gtc/session-catalog/sessions/gtc26-s81512/
S81530,Developing the First Generative AI Model of Global Fina...,https://www.nvidia.com/gtc/session-catalog/sessions/gtc26-s81530/
S81625,Build Purpose-Built AI Security With DOCA,https://www.nvidia.com/gtc/session-catalog/sessions/gtc26-s81625/
CWES81669,Develop World Foundation Models With NVIDIA Cosmos,https://www.nvidia.com/gtc/session-catalog/sessions/gtc26-cwes81669/
S81671,How to Build Planetary-Scale AI Infrastructure,https://www.nvidia.com/gtc/session-catalog/sessions/gtc26-s81671/
S81710,Swallow LLM: Continual Pre-Training and RL for Sovereig...,https://www.nvidia.com/gtc/session-catalog/sessions/gtc26-s81710/
S81724,The Road to Intelligent Mobility: How In-Vehicle GenAI...,https://www.nvidia.com/gtc/session-catalog/sessions/gtc26-s81724/
S81755,"Scaling AI Agents Globally Across Brands, Use Cases, an...",https://www.nvidia.com/gtc/session-catalog/sessions/gtc26-s81755/
S81770,Accelerating Quantum Chemistry on GPUs—Latest Advances,https://www.nvidia.com/gtc/session-catalog/sessions/gtc26-s81770/
S81791,The State of Open Source AI,https://www.nvidia.com/gtc/session-catalog/sessions/gtc26-s81791/
S81832,"How AI Is Changing Everyday Work, Insights from NVentur...",https://www.nvidia.com/gtc/session-catalog/sessions/gtc26-s81832/
S81864,Advancing Road Safety for Roadway Users With Caltrans​,https://www.nvidia.com/gtc/session-catalog/sessions/gtc26-s81864/
S81874,Charting a Course for the Next Decade of Gaming With AI,https://www.nvidia.com/gtc/session-catalog/sessions/gtc26-s81874/
CWES81906,AI Grids: Why Telcos Hold the Keys to Distributed Intel...,https://www.nvidia.com/gtc/session-catalog/sessions/gtc26-cwes81906/
CWES81934,Best Practices for Accelerating LLM and VLM Inference W...,https://www.nvidia.com/gtc/session-catalog/sessions/gtc26-cwes81934/
CWES82007,Best Practices for Accelerating LLM and VLM Inference W...,https://www.nvidia.com/gtc/session-catalog/sessions/gtc26-cwes82007/
S82154,Holistic Model Co-Design: Close the Loop With Software...,https://www.nvidia.com/gtc/session-catalog/sessions/gtc26-s82154/
S82161,2025 Gordon Bell Winner: Forecasting Tsunamis in Real T...,https://www.nvidia.com/gtc/session-catalog/sessions/gtc26-s82161/
CWES82169,Speech AI Model and Services Development and Customizat...,https://www.nvidia.com/gtc/session-catalog/sessions/gtc26-cwes82169/
S82174,"Building Local, Sovereign AI in Practice (Presented by...",https://www.nvidia.com/gtc/session-catalog/sessions/gtc26-s82174/
S82191,Benchmarking the Path to Useful Quantum Computers,https://www.nvidia.com/gtc/session-catalog/sessions/gtc26-s82191/
EX82210,From Imagination to Experimentation to Full-Scale Adopt...,https://www.nvidia.com/gtc/session-catalog/sessions/gtc26-ex82210/
CWES82212,Boost Data Science Pipelines With Accelerated Libraries,https://www.nvidia.com/gtc/session-catalog/sessions/gtc26-cwes82212/
S82266,Accelerate Enterprise AI Adoption: Secure Your Agentic...,https://www.nvidia.com/gtc/session-catalog/sessions/gtc26-s82266/
S82345,Hard-Won Lessons From Production Inference at Scale (Pr...,https://www.nvidia.com/gtc/session-catalog/sessions/gtc26-s82345/
EX82388,AI‑RAN in Action: GPU‑Accelerated Performance Gains Fro...,https://www.nvidia.com/gtc/session-catalog/sessions/gtc26-ex82388/
EX82275,Red Hat & NVIDIA: Driving Mainstream Enterprise AI Solu...,https://www.nvidia.com/gtc/session-catalog/sessions/gtc26-ex82275/
EX82433,Prioritize Accelerated Compute: Maximize Impact in a Su...,https://www.nvidia.com/gtc/session-catalog/sessions/gtc26-ex82433/
EX82194,From Foundation Models to SLMs: Powering Vertical AI Fa...,https://www.nvidia.com/gtc/session-catalog/sessions/gtc26-ex82194/
EX82401,The AI Cloud Behind the Breakthroughs: How Core42 Accel...,https://www.nvidia.com/gtc/session-catalog/sessions/gtc26-ex82401/
EX82242,Your Agent is Expensive and Wrong (Let's Fix Both!) (Pr...,https://www.nvidia.com/gtc/session-catalog/sessions/gtc26-ex82242/
EX82371,Transform Clinical and Commercial Workflows with AI Age...,https://www.nvidia.com/gtc/session-catalog/sessions/gtc26-ex82371/
EX82094,Network Automation Lessons Learned From Launching 20+ M...,https://www.nvidia.com/gtc/session-catalog/sessions/gtc26-ex82094/
EX82382,Building Dawn: An AI Agent for Mental Health With Clini...,https://www.nvidia.com/gtc/session-catalog/sessions/gtc26-ex82382/
EX81904,"Why AI Requires Vertically Integrated, AI-Native Cloud...",https://www.nvidia.com/gtc/session-catalog/sessions/gtc26-ex81904/
EX82361,Opentrons: Close the Gap Between Intent and Execution i...,https://www.nvidia.com/gtc/session-catalog/sessions/gtc26-ex82361/
EX82363,NVIDIA Inception Presents: Startup Pitches,https://www.nvidia.com/gtc/session-catalog/sessions/gtc26-ex82363/
EX82386,When Surgical Intelligence Becomes Embodied: The Agenti...,https://www.nvidia.com/gtc/session-catalog/sessions/gtc26-ex82386/
S81935,从视觉还原到物理交互： 物理可驱动3D 资产生成技术 Beyond Visual...,https://www.nvidia.com/gtc/session-catalog/sessions/gtc26-s81935/
S81943,利用 NVIDIA Dynamo Router 的 LongCat-Flash...,https://www.nvidia.com/gtc/session-catalog/sessions/gtc26-s81943/
S82358,以 WAM 为核心构建全域 AI 2.0，AI+车技术实践分享,https://www.nvidia.com/gtc/session-catalog/sessions/gtc26-s82358/
WP81836,Watch Party: 用於即時影像理解的視覺 AI 代理,https://www.nvidia.com/gtc/session-catalog/sessions/gtc26-wp81836/
S81962,基于 NVIDIA Jetson Thor 的机器人视觉解决方案,https://www.nvidia.com/gtc/session-catalog/sessions/gtc26-s81962/
S81990,智能融合：下一代端到端架构演进,https://www.nvidia.com/gtc/session-catalog/sessions/gtc26-s81990/
S82347,基于 Megatron-Core 的动态自适应并行训练方案,https://www.nvidia.com/gtc/session-catalog/sessions/gtc26-s82347/
